text,label_class,label
孩子牙疼虫牙，带去医院看病了。能不能吃这个药呢？,治疗方法,5
老年人心肌梗死的症状有哪些特点？,临床表现(病症表现),3
鼻子里面疼太阳穴疼怎么回事呀，怀孕十一周出现这样的情况有什么好的办法可以缓解？,治疗方法,5
血管瘤，请问该吃什么药能治好，现在孩子才1个月的大，内蒙古婴儿的血管瘤多长时间治疗为佳？,治疗方法,5
本人37岁，孕28周，查空腹血糖5.24，餐后一小时9.47，餐后两小时8.06，请问这可以考虑妊娠糖尿病吗？,定义,0
长步的稳心颗粒无蔗糖跟普通的在效果上有区别吗？如果都是一样的话我就买普通的吃了,其他,12
心绞痛可以运动吗,治疗方法,5
外痔是怎么治疗的？微创手术好吗？你们医院有吗？,治疗方法,5
咋样绕开肺地丝菌病,预防,2
孕晚期总是睡不着失眠严重，要怎么调理呢？我现在基本每天晚上都要在床上折腾一个多小时。,治疗方法,5
我患有结核性脑膜炎现在颅内压正常不知道为什么发烧反复。,病因,1
孕晚期晚上半夜睡不着怎么办好呢？我现在失眠好严重的，有办法改善吗？,治疗方法,5
新生儿4天核磁双侧侧脑室前角旁点状t2flair像高信号是什么意思,定义,0
这段时间一直鼻子不通气，嗓子里有痰，咳不出来，是黄色的，咽不下去咳不出来，要吃什么药,治疗方法,5
请问是高血压引起的中风，导致右半身偏瘫，可以吃中风回春丸吗？自己对药物不清楚，想询问下医生！,治疗方法,5
变异性哮喘可以治愈吗,治愈率,8
碱性磷酸钙结晶沉积病应该看啥医生,所属科室,6
心悸早搏是什么感觉,临床表现(病症表现),3
我上周在市医院检查发现阴唇系带有尖锐湿疣，问下怎么做才能治疗不复发呢?平时应该多吃点什么好？,治疗方法,5
用桑姜注射液或其他注射液直肠给药时如何把握计量？,治疗方法,5
便脓便血有什么方法可以治疗？,治疗方法,5
打扰问一下妇产科静脉血栓病做啥检查,化验/体检方案,10
先天性心脏病患者，可不可以使用增乳产品啊？,禁忌,9
腺泡状软组织肉瘤会传给老人吗,传染性,7
孕期坐骨神经痛怎么办？有没有什么办法可以改善的吗？有知道的吗？,治疗方法,5
我月经来了几天，可我洗头了还吃了一包辣辣咋办,治疗方法,5
孕妇吃钙片还会脚抽筋，怎么回事呢？是不是我吃的钙片牌子不好呢？,病因,1
吃同仁堂跌打丸的时候要忌什么？,禁忌,9
"""哪些人比较容易得血管瘤,我家孩子屁股上长有血管瘤，像旺仔小馒头一样的，有凸起，内蒙古婴儿长在屁股上的血管瘤咋治？""",治疗方法,5
痔疮，肛门瘙痒，直肠也会发生坠痛，痔疮如何针灸？,治疗方法,5
心口发紧，心慌意乱，嘴里还感觉不对劲，感觉左手还没劲，头还有点疼，好几天了，,临床表现(病症表现),3
你好；请问健骨生丸的主治症状及成份分别有那些呢？,其他,12
我的弟弟有癫痫病，已经一年多了。一直都在吃药治疗，但是都没有什么好的效果，该怎么去治疗呢？怎么样治疗好呢,治疗方法,5
眼部神经纤维瘤病有什么饮食禁忌吗？,禁忌,9
您好，肝郁气滞会累及心悸心虚吗？,相关病症,4
如果得了慢性附睾炎易发人群是哪些人,病因,1
孩子的生殖器上起了好多小豆不疼不痒不知道是什么,定义,0
可以问一下病毒性心肌炎有什么定义？,定义,0
打扰问一下小儿月经过多做啥体检呢？,化验/体检方案,10
肾盏憩室看啥科呢,所属科室,6
以前安医生的处方服用过安特尔有明显的效果，现在怎么能买到安特尔。,其他,12
先心病的发病率是怎么样的呢？,其他,12
心绞痛能吃什么食物好,治疗方法,5
怎么办上课睡觉，她不爱说话特别内向,其他,12
怎么治疗脑出血,治疗方法,5
小便痛，是什么原因呢？,病因,1
请问作息时间不规律会导致月经不调吗？,病因,1
心包破损伤是怎么回事？,定义,0
子宫多发肌瘤，做微创能全部清处掉吗,治愈率,8
大便出血！便中没带血，擦拭才有血！屁股不痛不痒！需要去医院，已经3天了！,临床表现(病症表现),3
心电图彩超结果，三尖瓣少量反流，这个是不是要用药物才行。,治疗方法,5
孕妇拉肚子了怎么办~~~急~~急~~急,治疗方法,5
上厕所拉尿很难拉，伴有疼痛感，下腹胀老想上厕所，吃了那个复方石韦胶囊都没有用，反而多喝水有点效果，请问有什么药可以吃吗,治疗方法,5
颈部脊髓损伤可以怎么诊断,化验/体检方案,10
心跳，全身麻痛。会热，无力,临床表现(病症表现),3
医生开葵花通脉颗粒吃完了，你们网上药店有葵花通脉颗粒这个药出售吗？如何购买啊？,其他,12
我家宝宝21天吃母乳一天拉10多次，算不算拉肚子,定义,0
"""我服用半片伲福达,血压在80-120但是有脸部发热.心悸,要不要紧？""",临床表现(病症表现),3
直观一点讲内痔和外痔的区别是什么？,定义,0
采取什么方法抵御老年人缺血性心肌病,预防,2
鼻/鼻型T/NK细胞淋巴瘤如何体检,化验/体检方案,10
孩子身上有一块白斑，不知道什么时候起的，没有去医院检查，请问曲靖夏季孩子身上的白斑会是白癜风吗？,定义,0
现在白斑一直在发展，控制不太住，着急死了，曲靖夏季怎样护理正在发展的白癜风？,治疗方法,5
请问咸板鸭是什么性质的？经期能吃咸板鸭么？,禁忌,9
吃厄贝沙坦片对心脏早搏的人有好处吗？大概要吃多久副作用才会出来,治疗方法,5
绵阳肛肠医院治疗便秘经常性便秘怎么办,治疗方法,5
30天后发现孩子的嘴角红红的，鼓包，医生说没问题，只是个血管瘤，哪我想知道，内蒙古婴儿嘴角的血管瘤能治好不？,治愈率,8
医生您好！我父亲现在心衰极其痛苦，请问怎样帮他缓解呼吸困难?,治疗方法,5
自从吃了这个药物好像血压偶尔偏高这是怎么回事啊医生谢了,病因,1
女性小便有血怎么回事？,病因,1
"""我抽烟,烟龄7年,有慢性支气管炎,现在会有呼吸困难,胸闷,有痰,痰喘,这些症状,怎么办?;""",治疗方法,5
药流20天尿发红有白带白带有臭味带血,临床表现(病症表现),3
大便干，疼，有血，是痔疮。痔疮根据病况分几种？,定义,0
我今年49岁，患有轻度高血压，想问：如果服用补中益气丸会有不良后果吗？如果有，是什么？,禁忌,9
刚患上外痔，要如何预防治疗才好？,治疗方法,5
心肌梗塞恢复期，吃什么药好。请问这是怎么回事？解决办法是什么？,治疗方法,5
多年的外痔怎么能根治？,治愈率,8
大便有点血是直肠癌吗？,定义,0
脸部的白癜风会不会传染？脸上的白斑点不多，就几块，白斑显示出乳白色,传染性,7
多年呼吸困难，检查过，查不出问题，吃过很多药也没用，这个是什么引起的,病因,1
高血压水肿用什么药？,治疗方法,5
咳嗽还有一点点嗓子有痰的声音,临床表现(病症表现),3
风湿性心脏病可以吃什么,禁忌,9
怎么检查有强迫症,化验/体检方案,10
宝宝拉肚子吃什么好啊？,治疗方法,5
痔疮打什么针见效快?,治疗方法,5
请问外阴瘙痒排尿刺痛怎么回事呢？,病因,1
我爸有高血压病史，一直吃降血压药，渐渐的心率也变的低了，我担心会窦性心动过缓，我想问一下窦性心动过缓的症状有哪些呢？,临床表现(病症表现),3
剖腹产后74天了，一直没来月经，最近分泌物增多，类似排卵期的透明能拉丝的，伴随有异味怎么回事，是母乳奶粉混合喂养的。,病因,1
老是盗汗失眠、腰酸背痛，在性事方面也不是很如意,临床表现(病症表现),3
我是在户外工作的，最近刚检查出来的白癜风，医生说我不能在户外待太久这是怎么回事？,病因,1
现在感觉左边胸部时不时有疼痛的感觉，长的是血管瘤，内蒙古婴儿长了海绵状的血管瘤的治疗方法有吗？,治疗方法,5
家里人有肺结核，宝宝可能不小心误吃了他的饮料会被传染吗？宝宝打过卡介疫苗,传染性,7
我是女性的，肛门周边长毛是怎么回事?感觉有些不舒服了，想除掉了它，能吗,病因,1
请问肠炎病人吃有什么比较好？,禁忌,9
晚上老咳嗽，呼吸不上来，鼻子不通，好几天了该吃什么药好,治疗方法,5
请问尿不尽，是什么原因啊？,病因,1
请问有没有维Ｄ2果糖酸钙注身液有没有途径可以找到？,其他,12
请问阴道有黑色的分泌物怎么办？,治疗方法,5
"""你好,请问患了膀胱炎要吃什么药治疗?""",治疗方法,5
安定门中医院看病怎么样？,其他,12
我家宝宝六个月了，我前两天发高烧血压低了怎么办,治疗方法,5
支气管扩张和哮喘哪个严重,其他,12
做支架二年又心绞痛怎么回事？,病因,1
间质性肺炎怎么治疗?,治疗方法,5
我高压170.低压88.心跳50。正常吗？,定义,0
打扰问一下热毒冲心如何体检,化验/体检方案,10
心绞痛如何食疗,治疗方法,5
药品联合使用是大家比较关注的问题，请问多糖铁复合物胶囊能和碳酸钙d3颗粒混着吃吗？,禁忌,9
结节性液化性脂膜炎有什么一并出现,相关病症,4
高压97低压60正常吗,定义,0
孩子总是爱咳嗽晚上多一点，白天很少，这是什么问题？,病因,1
郑州专看癫痫病的医院如何确诊癫痫病小孩晚上偶尔会有一个胳膊和腿抽搐现象，在当地检查是癫痫病，需要进一步确诊一下,化验/体检方案,10
对于胃癌病人，在饮食方面有何注意事项,禁忌,9
发烧39度4天，喉咙痛，轻微咳嗽，吃药，打针，烧就是降不下来，血常规正常，胸片显示，说气管炎。,临床表现(病症表现),3
妈妈是甲状腺机能亢进患者，可以用酒石酸美托洛尔缓释片治疗吗？效果怎么样？,治疗方法,5
最近朋友伤口感染了，皮肤溃烂，可以使用盐酸利多卡因凝胶麻醉切除吗？去哪可以购买到？,治疗方法,5
我想请问一下亚甲炎可以吃布洛芬消炎片吗？能不麻烦您一下帮我解答。,治疗方法,5
小便是红色是什么原因,病因,1
氨苄西林胶囊7岁半的儿童可以服用吗?用量是多少适合服用吗,治疗方法,5
什么叫空腹血糖受损？,定义,0
请问尿路感染的用什么药啊？,治疗方法,5
要吃什么药物还可以缓解病情呀？或者减低不良反应都好呀，我真的好痛苦的，特别是呕吐呀,治疗方法,5
医生您好，我得了甲亢，想问医生怎么治疗,治疗方法,5
孩孩子背部长的血管瘤怎么治疗，到那些医院治疗。现在孩子5月多点大，血管瘤有凸起，内蒙古婴儿后背血管瘤能治好吗？,治疗方法,5
肺纤维化是什么病?,定义,0
你好，麻烦问一下老年人急性淋巴细胞白血病治好得多少年,治疗时间,11
我得了湿疣，不多在阴道壁上，就俩处，激光完了又复发了咋办？,治疗方法,5
心胸汗出是怎么回事？,定义,0
没有病史，这是第一次，医生说长了湿疣，在阴道上也长了，这样的情况下怎么治疗？,治疗方法,5
请问中度宫颈糜烂能保守治疗吗？,治疗方法,5
左腿粗。右腿细。右脚血管瘤。怎么调理呢，内蒙古婴儿脚部大的血管瘤咋治啊？,治疗方法,5
胶质瘤术后有什么好的方法预防复发,预防,2
怎样解决宝宝消化不良,治疗方法,5
我窦性心律，窒性早搏，我到底需要注意些什么呢？,禁忌,9
你好！糖尿病服用苯磺酸氨氯地平片要注意什么？,禁忌,9
被掐脖子后痰多口水多,临床表现(病症表现),3
怎么治疗妊娠合并偏头痛,治疗方法,5
我妈查到患有冠心病，有亲戚就送了几盒双红活血胶囊来，这药是治冠心病没错吧？,治疗方法,5
肛瘘用什么药啊,治疗方法,5
心绞痛心脏彩超能查出什么,化验/体检方案,10
一个发小的儿子是癫痫疾病，是小时候发烧引起的，已经好几年了，这个病好像影响了孩子的治疗，请问小儿癫痫的危害有什么？,相关病症,4
西盟佤族自治县治疗脑瘫哪个医院好？,其他,12
尿不净，是怎么回事？,病因,1
直肠腺癌能治好吗？手术能活下来吗？,治愈率,8
哪些运动项目适合哮喘患者,治疗方法,5
喝酒后马上想上厕所，怎么回事？,病因,1
食管癌有什么不能吃的,禁忌,9
从出身下来就有，现在5个月了。用什么方法治疗？谢谢，长在孩子脚趾的血管瘤，内蒙古婴儿在脚趾长有血管瘤咋治好呢？,治疗方法,5
请问外阴唇上面长了一个小痘痘怎么办？,治疗方法,5
以前做过一次痔疮手术，已经有五六年了，最近发现好像又有一颗痔疮，很小不痛，而且有点痒，应如何治疗？,治疗方法,5
这几天感觉下腹胀痛，尿频！左耳耳鸣！下腹按着感觉疼痛！,临床表现(病症表现),3
肺部纤维化，间质炎，近来干咳严重,临床表现(病症表现),3
选择性腰骶神经后跟切断术的适应症是什么？,定义,0
请问月经过后白带带血持续两个月怎么办？,治疗方法,5
您好，请问奥科维高电位治疗仪对治疗脑梗有帮助吗？,治疗方法,5
成都比较好的肛肠医院治疗便秘费用吃什么东西治便秘,治疗方法,5
脑膜脑炎是如何引起的？,病因,1
婴儿鱼肝油怎么吃？,治疗方法,5
整体很悲伤，消极、把事情想的很悲观，莫名其妙的哭、狂躁，容易怀疑自己，觉得活着痛苦,临床表现(病症表现),3
细菌性前列腺炎要怎么治疗呢,治疗方法,5
理解能力下降，睾丸疼痛，有什么要特别预防的？有什么要注意的事情？,预防,2
手爆裂，晚上痛的睡不着，我这是怎么了？该如何调理？,治疗方法,5
我患上内痔很多年了经常会出血，现在大便也开始变形了，不知道是否患上其他病？,相关病症,4
慢阻肺症状是什么?,临床表现(病症表现),3
着凉会心悸吗,病因,1
您好。医生，我想咨询一下小便时阴茎有灼热感怎么回事,病因,1
两个小腿酸软，没劲，感觉好累，有时会抽筋，我想知道这是不是缺钙，要怎么补钙，什么食物补钙又好又快,治疗方法,5
什么方法能逃开坏死性肠炎,预防,2
膀胱炎吃什么药好？,治疗方法,5
我家宝宝这几天有点拉肚子是不是和喝母乳又喝牛奶又喝羊奶有关,病因,1
我该如何抵制手汗症,预防,2
阜阳治癫痫的医院？？表弟最近去医院检查出了癫痫，家里不是很富裕，难倒了一家人，癫痫治疗需要多少钱？癫痫治疗需要多少钱呢,其他,12
单纯性雀斑样痣有什么一起发生,相关病症,4
小孩子在肚子里从下午踢到晚上是什么回事？,病因,1
扩张型心肌病会遗传的吗？,病因,1
请问维思通利培酮口服液会有哪些性状啊我爸帮我买回来了能告诉.,其他,12
冒昧问一下能否介绍一下镍及其化合物引起的皮肤病解释,定义,0
肛门左侧长了个鸡蛋大的疙瘩。带的周围都肿了。是什么原因。,病因,1
我想请问一下，尿频尿急拉尿痛不知道是什么病啊,定义,0
左肺下叶少许感染抗生素治疗半月效果不好咳嗽痰多但是痰容易咳出来有时还胸痛,临床表现(病症表现),3
请问美洛昔康片的主治功能是什么？该药好不好用？,定义,0
颌面部神经纤维瘤能治吗,治愈率,8
在日常生活中要如何预防肠癌,预防,2
心慌心悸胸闷有什么喷剂,治疗方法,5
原发性醛固酮增多症治好要多少天,治疗时间,11
请问阴道这几天都很痒是怎么回事？该怎么办呢？,病因,1
慢性肾小球肾炎完全治愈要多久,治疗时间,11
急！宝宝喝完奶老是吐奶和打嗝，该怎么办？？？,治疗方法,5
女性更年期怎么办？怎么调理才会好？多运动好吗？,治疗方法,5
宝宝嘴里溃疡怎么办,治疗方法,5
生完孩子20多天了，发现分泌物是黄绿色的，有时候还有异味，外阴有瘙痒感，烧灼感,临床表现(病症表现),3
胸口会痛，但是呼吸正常,临床表现(病症表现),3
您好，我患有细菌性前列腺炎，这和非细菌的有什么区别？,定义,0
问一下十二指肠损伤有什么伴随发生,相关病症,4
冒昧问一下老年人梅毒性心脏病看啥科呢,所属科室,6
肾里面有个小石子，就是肾结石，很小的，请问用什么药好？,治疗方法,5
外痔需要手术治疗吗？用药物可以吗,治疗方法,5
我肛门口长了个小肉球有点痛是什么,定义,0
夜里多梦多尿怎办啊呢？怀孕晚期了，总是半夜要起来拉尿，而且老做梦的呢！,治疗方法,5
孕晚期每天都睡不着觉，失眠好严重的，怎么办好呢？有缓解的办法吗？,治疗方法,5
脊髓蛛网膜炎如何治疗？,治疗方法,5
请问阴道镜术后出血正常吗？,临床表现(病症表现),3
上班时候身上出了很多汗下班了脱了衣服没有想到身上起来了好多红疹，越爪越多，现在应该怎么办，,治疗方法,5
我患有更年期综合征，朋友建议服用谷维素双维B片，请问这药有什么不良反应，要注意什么问题？,禁忌,9
尿路感染是什么原因引起的,病因,1
如果得了游走性结节性脂膜炎容易感染不,传染性,7
肛门右前就有软软的肉球的东西。想咨询是否是早期外痔？,定义,0
阴茎短小是什么问题？,定义,0
早搏16000二联110现在吃稳心颗粒和胺碘酮不吃药的时候，没有感觉胸脯疼，现在吃药感觉胸脯疼，是怎么回事,病因,1
突然睡到那里，然后突然心脏就疼的特别厉害，疼了十几分钟，然后也疼是没那么疼了，该怎么办？,治疗方法,5
42岁月经不调腹胀怎么治疗？,治疗方法,5
强迫症遗传吗？,病因,1
你好，我想咨询一下，长期服用芮达帕利哌酮缓释片会产生依赖性吗？,禁忌,9
血糖十点三。用欲混型门东胰岛素，分两次打三十二单位。为了预防并发症能推荐一些调理型中药。,预防,2
手工做宝宝棉裤裁剪图在哪里可以找到吗？我想学习帮孩子做裤子，反正在家里没事做。,其他,12
原发性腹膜炎怎么办,治疗方法,5
老年人如何预防脑梗塞？,预防,2
请教一下蝎螫伤现象,临床表现(病症表现),3
大便出血大概两个月，通过改善饮食和每天坐浴可以痊愈吗？不用药可以治疗内痔吗？如果用药用什么药？,治疗方法,5
如果得了精神活性物质所致精神障碍会传染给其他人吗？,传染性,7
手足徐动症的病因是什么,病因,1
请问月经一直推后怎么办？,治疗方法,5
颈髓损伤有9个月了做高压氧有郊果吗,治疗方法,5
你好，请问高血压病人能不能将复方罗布麻片、复方丹参片和曲克芦丁片一起来吃啊,治疗方法,5
痉挛性斜颈得治疗几个小时,治疗时间,11
孩子四个月了大便还是来的奶瓣子,临床表现(病症表现),3
肚子腾怎么办?,治疗方法,5
汉坦病毒肺综合征要治几多时间,治疗时间,11
血尿酸为何会升高？,病因,1
不同类型的肌无力症状表现有什么不同？,临床表现(病症表现),3
孕妇得了痔疮能顺产吗,治疗方法,5
肛门有小坠感，大便有血，可用什么药治疗？,治疗方法,5
请问月经每次只来了一点点怎么回事？,病因,1
"""我上完环,肚子胀痛会不会影响以后怀孕？""",相关病症,4
病毒性心包炎是什么病,定义,0
请教一下赖利-戴综合征属于什么科,所属科室,6
臉上覺得有點紅紅的，又不想吃東西，想睡覺，肚子脹不知道怎麼辦,治疗方法,5
肚子左边肋骨下有疼痛，尤其是晚..,临床表现(病症表现),3
请问颅骨骨膜窦症状是什么,临床表现(病症表现),3
怎么治疗闭合性脑外伤,治疗方法,5
没有怀孕整天恶心啊，干呕,临床表现(病症表现),3
妊娠合并动脉导管未闭是什么病,定义,0
开放性颅脑损伤易发人群有哪些,病因,1
月经期间总是腹痛怎么办,治疗方法,5
我贫血，还血压低，吃什么药？,治疗方法,5
iv级心衰可以做风湿性心脏病手术吗？,治疗方法,5
尿频尿急、腰酸是什么病,定义,0
心悸心慌失眠吃什么药,治疗方法,5
请问一下，盐酸曲唑酮片长期服用可以吗？,治疗方法,5
什么是弥漫性血管瘤,定义,0
请问妇科B超检查确定有少少量盆腔积液是什么病？,定义,0
慢性支气管炎到底要怎么治疗才能好,治疗方法,5
如何判断颈动脉的狭窄程度？,化验/体检方案,10
颈动脉硬化的治疗方法有哪些,治疗方法,5
慢性食管炎怎么诊断,化验/体检方案,10
2个月宝宝爱手舞足蹈正常吗？有点担心宝宝又不是有多动症，求科普。,定义,0
怀孕了检查nt是什么？,定义,0
煤炭工尘肺容易感染不,传染性,7
请教一下拉休尤-格拉哈姆-利特尔综合征要治多久,治疗时间,11
小便后阴道疼是怎么回事小便后阴道疼是怎么回事,病因,1
1我老婆俩天了一到凌晨三点多就恶心呕吐这是怎么了,病因,1
变异性哮喘如何治疗?,治疗方法,5
宝宝上火，大便干燥,临床表现(病症表现),3
淋巴血管瘤2.5+2.4有影响没因注意什么，长在孩子脖子上的，内蒙古婴儿得了淋巴血管瘤能治好吗？,治愈率,8
哪些情况会引起尿路狭窄？,病因,1
心悸头晕恶心是怎么回事,病因,1
你好医生，小便后总是觉得不舒服,临床表现(病症表现),3
脑梗3个月了，这3个月一直用的是那远程缺血预适应训练仪脑心健，现在情况都消失，头晕也改善了，这是什么原理？,病因,1
老想上厕所，一天上七八次，但是去厕所又尿了一点点，刚从厕所出来又想上厕所,临床表现(病症表现),3
做过痔疮手术打过麻醉针，在11天之后我能在打吗，会在没什么影响,治疗方法,5
请问月经不调血色黑怎么办？,治疗方法,5
你好，麻烦问一下二氧化硫中毒看啥科呢,所属科室,6
我心跳突然好快一分钟140好难受如何让尽快恢复正常,治疗方法,5
如果得了强直性脊柱炎性巩膜炎可治率多高？,治愈率,8
宝宝拉肚子快俩月了,临床表现(病症表现),3
宝宝黄疸退的很慢？,临床表现(病症表现),3
问一下脾囊肿要治多久,治疗时间,11
小孩肚子疼，爱大便,临床表现(病症表现),3
我该怎样逃避获得性循坏抗凝物质增多综合征,预防,2
我很久以前就患上过敏性哮喘，每年都会在这时候发作，该怎么办?,治疗方法,5
大便不成型和缺钙有没有关系,病因,1
刨妇产两个半月老是恶心还老是放屁拉不出屎来怎么回事,病因,1
请问感冒耳朵嗡嗡响怎么办？,治疗方法,5
慢阻肺疾病治疗偏方,治疗方法,5
我每天心慌呼吸困难提不上气来心电图有房性心动过速二十四小时心电图有阵发性心动过速,临床表现(病症表现),3
小便的时候有刺痛感。是怎么回事？,病因,1
多发性腔隙性脑梗死的病因是什么？,病因,1
心绞痛一定是冠心病吗,病因,1
可以介绍颅骨骨瘤的释义,定义,0
做了两回痔疮，怎么还没有好？请问有什么好法吗？,治疗方法,5
"""孩子面部长的血管瘤，血管瘤处凸起是怎么回事,现在孩子4个月大了，内蒙古婴儿面部的血管瘤怎么治好？""",治疗方法,5
头磕了一个大包一小时就落了还恶心怎么回事,病因,1
之前咳嗽没那么频繁，医生贴了贴子，吃了药之后睡着了不咳嗽醒了一还直咳,临床表现(病症表现),3
医生您好请问B超单上膀胱充盈不佳是什么原因?,病因,1
孕吐得很厉害怎么办,治疗方法,5
心神不定，寝食难安整天胡思乱想，没精神头白天不想吃东西，也不觉得饿，而且总是很困,临床表现(病症表现),3
病后体虚，失眠应该服用什么药比较有效？有哪些需要注意的？,治疗方法,5
我总觉得弟弟特别的痒，起了好多小水泡泡，之前以为就是湿疹。可是后来上医院检查发现不是，是叫尖锐湿疣的一个病，这种性病特别难治。请问尖锐湿疣这个疾病到底能不能治愈呢？,治愈率,8
你好，我明天体检，前几天感冒了，今天感觉好多了，就是有点流鼻涕，对明天的体检会有影响吗？,化验/体检方案,10
我该如何免得肠伤寒,预防,2
胃消化不好怎么办,治疗方法,5
2个月婴儿得了血管瘤，血管瘤长在孩子的身上，有明显的凸起，内蒙古婴儿的血管瘤在医院找哪个科？,所属科室,6
小孩呼吸肚子动得好厉害,临床表现(病症表现),3
感冒能引起高血压吗?,病因,1
请问59岁得了膀胱结石，前列腺增大排尿障碍，要如何治疗呢？,治疗方法,5
请问顺产后手脚骨头痛是什么原因啊？是不是生孩子的时候没生好落下的病根啊？,病因,1
经常尿不尽，已有两年，尿完后，老觉得肚子憋尿，没尿尽，请问医生需要做啥检查，,化验/体检方案,10
疑神疑鬼，心神不宁，焦虑,临床表现(病症表现),3
尿痛是指尿什么位置痛？尿痛是指尿什么位置痛？,定义,0
两鬓太阳穴上方胀痛，这几天老是这样，我怀孕八个月了，这种是什么情况呢？,病因,1
