text,label_class,label
现在头痛家里只有头孢克肟片，有什么需要注意的呢？在饮食和作息方面的,禁忌,9
食醋可不可以促进睡眠啊？生了孩子之后就老失眠，应该怎么办呢？,治疗方法,5
问一下肾盏积水会让我得上吗,传染性,7
三叉神经营养性损害怎么办,治疗方法,5
打耳洞了，现在有点痒，能不能擦碘伏,治疗方法,5
我想请问一下，阴茎瘙痒，有分泌物，小便的时候微痛，不知道这是为什么？,病因,1
支气管炎怎么治最有效,治疗方法,5
我的右边脸部眼下部分抽搐，这是什么原因造成的呢？,病因,1
热性惊厥怎么回事,定义,0
卵巢肿瘤破裂治疗周期？,治疗时间,11
小孩吃东西就说肚子痛还吐是怎么回事,病因,1
我是糖尿病患者，该怎么样用药？用法用量是多少？,治疗方法,5
请问药流后有血是月经吗？,定义,0
女性小便次数多是什么原因,病因,1
肛乳头瘤手术后容易复发么？,治愈率,8
哮喘难道真的治不好吗,治愈率,8
用高锰酸钾溶液清洗一天后，蹲下做事情的时候小鸡有点疼，站着就没事。怎么回事,病因,1
糖尿病性胃轻瘫要花多少时间治好,治疗时间,11
为什么喝完咖啡后会全身使不上力、手抖等现象出现呢？心跳有点过快一点点但又不算心脏病的人喝了还会出现那些症状吗？,病因,1
滴虫性尿道炎的治疗方法,治疗方法,5
外痔有半个月左右，不疼有点痒不流血，可以用痔疮膏？,治疗方法,5
最近一直头晕眼花，站不稳，请问有什么药可以改善？,治疗方法,5
我检查后是血糖高的，是不是不可以吃蜂蜜了？,禁忌,9
冒昧问一下垂体前叶机能减退症做啥检查,化验/体检方案,10
宝宝多吃鱼肝油好不好啊？听说鱼肝油要和钙片一起吃，是不是啊，有什么作用呢？,其他,12
右面屁部一直到腿部疼痛麻木，请问这是什么情况导致的，,病因,1
肛门潮湿和小腹坠胀需要做什么捡查,化验/体检方案,10
心脏神经官能症是心脏病吗,定义,0
全天麻丸对治疗风湿有没有效果？需要按疗程服用吗？,治疗方法,5
问一下自发性蛛网膜下腔出血需要做什么检查,化验/体检方案,10
我孩子头部长黄豆大小颗粒，经病检是血管瘤，已长达八个月时间，啥子症庄都没有，只是发痒，内蒙古婴儿在头部长的血管瘤咋治啊？,治疗方法,5
请问例假血色白带怎么办？,治疗方法,5
怀孕两个月肚子胀怎么办,治疗方法,5
宫颈癌疫苗能预防宫颈癌吗,预防,2
我小便次数多是什么原因这是怎么回事的啊怎么办才好啊现在,病因,1
早孕检查流程是怎样的呢？,化验/体检方案,10
阴道和宫颈都得了湿疣，激光后一个多星期可以用克痒舒洗液来洗外阴吗,治疗方法,5
请问阴道和肛门同时性交有什么危害？,相关病症,4
慢性支气管炎症状及表现,临床表现(病症表现),3
小儿多动症能治愈吗？我的小孩有多动症，吃了好多药都没有效，这种病能治好吗？,治愈率,8
痔疮会自己好吗,治愈率,8
你好，医生请问一下，吃了避孕药之后，上小便时觉得自己尿不尽是怎么回事？,病因,1
你好。.请问盐酸舍曲林片对治疗无躁狂史的抑郁症有用吗，该怎么服用呢？,治疗方法,5
我停经感觉出汗睡不着有什么需要注意的呢？在饮食和作息方面的,禁忌,9
脊柱裂看什么医生,所属科室,6
如果把医用碘酒和汞溴红溶液一起使用的话，会不会一起中毒反应？严重吗？,禁忌,9
请问月经干净后两天为什么会流出咖啡色液体？,病因,1
脑疝易发人群有哪些,病因,1
血压高就是高血压吗？,定义,0
高血压患者，前天检查了胆固醇很高，血压也很高，要怎么注意比较好,禁忌,9
孕妇得了痔疮怎么办,治疗方法,5
复方丹参片可以和酒石酸美托洛尔片一起服用的吗，效果怎么样的,禁忌,9
高焦虑症患者在服用律康时应该注意什么？,禁忌,9
脊髓外伤要做哪些检查,化验/体检方案,10
我妹今天去医院做了心电图，检查出窦性心动过缓，在高中时候我们学过电生理，我想问一下窦性心动过缓和传导阻滞有关吗？,相关病症,4
孩子不爱吃饭只吃母乳怎么办,治疗方法,5
我是胆固醇比较高，每天晚上睡觉前吃半片不知道行不行的,治疗方法,5
儿童癫痫病治疗的时间是多?伴随着现今社会的不断前进与发展，而患病的人群有许多，然而不管怎么说关于癫痫的治疗都是不可忽视的，可是儿童癫痫治疗的时间是多久?,治疗时间,11
什么叫心悸脉结代,定义,0
培哚普利片对高血压有用吗？还有哪些作用啊？,治疗方法,5
新生儿恶心的原因,病因,1
复发性溃疡要做什么化验治疗吗,化验/体检方案,10
肠癌如何进行多学科诊治,治疗方法,5
请教一下眼眶黏液囊肿治好要多少天,治疗时间,11
松节油皮炎能否治好,治愈率,8
中风之后半身不遂、语言障碍，这种情况适合用点什么药治疗适合呢？平时有什么要注意的？,治疗方法,5
慢阻肺是一种什么样的病？和其他呼吸疾病有什么不同之处？,定义,0
患有内痔一星期，大便时会流很多血，不痛，平时感觉肛门很痒，用了马应龙痔疮栓无效，找中医开了中药后又复发，应如何治疗？,治疗方法,5
便血，肛门处有小肉疙瘩，硬的，是痔疮，得了痔疮不手术不开刀如何治疗？,治疗方法,5
孕37周加腰和臀部酸痛正常吗？之前都没有这种感觉就是这几天才有的痛感。,临床表现(病症表现),3
我要宝宝有一岁零四个月。喝水呛到，咳嗽两三天了，还没好。该怎么办呢？,治疗方法,5
利福平胶囊的禁忌,禁忌,9
慢阻肺能不能治好呢?,治愈率,8
有时浑身无力，咳嗽，低烧贫血气虚该怎么调养,治疗方法,5
感冒时出现哪些症状要警惕心肌炎？,临床表现(病症表现),3
请问乳腺癌术后刀口增生且有液流出是什么原因,病因,1
肛门被擦破了该怎么办,治疗方法,5
我脚轻微骨折打石膏板一个月了，站的时间长了，还是有点肿碍事不，我想把石膏板去掉行不行,治疗方法,5
男士，有时小便刺痛，小便后滴几滴血色，怎么会这样啊,病因,1
你好！波立维有没规定在是饭前吃还是饭后吃，对于治疗不稳定性心绞痛或非Q波心肌梗死)患者的量是怎么样的？,治疗方法,5
爸爸是有冠心病的情况，之前是吃其他药的，现在可以换成其他的吗？,治疗方法,5
请问胃炎都有什么表现？,临床表现(病症表现),3
肛门内部周围出现痉挛性疼痛最佳的治疗方法是什么啊,治疗方法,5
间质性肺炎晚期症状表现有哪些,临床表现(病症表现),3
请问经期前三四天左右开始左侧后腰痛属于什么问题？,定义,0
请问月经拖后二十天有问题吗？,临床表现(病症表现),3
小便完时候肚脐下来点那里疼，就疼那么几秒钟。请问是怎么回事。,病因,1
您好根尖周病病症是啥,临床表现(病症表现),3
最近晚上睡觉总是失眠，白天也睡不着该怎么办呢？如何治疗失眠啊？,治疗方法,5
胱氨酸b6鱼肝油治疗脂溢性头发能不能一起服用,禁忌,9
药流成功了，留出来了孕囊，但是药流20多天后有点想吐会不会出现有两个只打掉了一个的可能（未同房）,病因,1
宝宝老爱摇头怎么回事啊？是有小儿多动症吗？还是没什么问题啊？好担心！,病因,1
流产后的残留物怎么办,治疗方法,5
胸膜炎复查是要照胸片吗,化验/体检方案,10
高血压引起的耳鸣,相关病症,4
她有两年多病吏，现在经长左后背疼，请问是不是肺结核引起的？,病因,1
女朋友的妈妈得了心房颤动，女友说心跳很弱但是心跳的次数很多，女朋友担心她的母亲身体不正常，请问心房颤动每分钟心跳多少次？,临床表现(病症表现),3
什么是心悸怔忡,定义,0
我老公，勃起时候阴茎不粗只有25厘米的直径，长度只有13厘米该服用那种药物,治疗方法,5
过敏性哮喘怎么预防？,预防,2
肺气肿的发病原因是什么？,病因,1
宝宝4个月便秘怎么办,治疗方法,5
里急后重严重，晚上去3次厕所，便量少;大便稀，没便血症状！肛门痛，小腹疼痛。情绪易激动，要吃些什么药？,治疗方法,5
我想请问一下，尿道发疼，尿频但少，是怎么了,定义,0
婴儿可以经常葡萄糖水吗,禁忌,9
您好，郭大夫，我两只手都是小指和无名指麻木，您说是怎么回事呢,病因,1
直肠息肉活检钳切除后多长时间复查,治疗时间,11
脑疝的发病部位多是哪里？,临床表现(病症表现),3
克龄蒙主要用来治疗什么疾病，要怎么用才有效？,治疗方法,5
高血压，手臂发麻，怎么办,治疗方法,5
三个月半的宝宝半边脸红正常吗？有妈妈知道是怎么回事吗？,病因,1
左手关节中有个血管瘤你好:…我孩子5个月大，检查出左手关节的地方有个血管瘤压住手神经，想去医院看内蒙古婴儿的血管瘤挂什么科？,所属科室,6
我是原发性高血压，每天头痛或晖，低压90高压150左右。一直没用药，近期很严重，不知吃什么药能控制住,治疗方法,5
黄体血肿需要做什么检查,化验/体检方案,10
阴茎短小，有办法解决吗,治疗方法,5
为什么肿瘤患者不宜吃人参,禁忌,9
大便的时候肛门疼怎么治,治疗方法,5
我家孩子长的血管瘤9厘米在膝盖上的血管瘤，医生说不能动手术那能治好吗，内蒙古婴儿膝盖长了海绵状的血管瘤治疗方法有哪些？,治疗方法,5
冒昧问一下可以介绍锁喉毒的释义,定义,0
尿分叉是什么样子的？,临床表现(病症表现),3
请问一下，要计划怀孕，男方一直在咳嗽，用药断断续续，影响宝宝的健康不,相关病症,4
刚出生的婴儿黄疸什么时候消失？,治疗时间,11
今天不小心摔倒，膝盖现在发紫，肿痛，但是我患有糖尿病，可以使用脉血康胶囊(信邦)吗？,禁忌,9
医生你好我想问下，我尿道炎应该吃什么药好？,治疗方法,5
类风湿性关节炎肾损害治疗周期？,治疗时间,11
谷维素治疗早博吗?他能和复方丹参一起用的吗?我服用曼西律不管用，治疗早博可以吃吗?,治疗方法,5
复方丹参片能治眼花吗，这个病能用点什么来调理一下。,治疗方法,5
怎么治疗颅骨缺损,治疗方法,5
法洛四联症的症状是什么？,临床表现(病症表现),3
升主动脉瘤是什么病,定义,0
肾上腺素95比参考值高。这是什么意思,定义,0
"""谷维素的话是不是可以治疗神经性紊乱导致的早博,但是不确定早博是否是这个原因导致的?""",治疗方法,5
打扰问一下血小板促凝活性异常应该看啥医生,所属科室,6
甲钴胺片可以治疗啥样的病的呢，甲钴胺的治疗效果怎么样的啊,治疗方法,5
这两天，心脏经常疼，每次只疼十几秒，是为什么,病因,1
您好坏死性结节病样肉芽肿病痊愈几率,治愈率,8
强迫症为什么打人,病因,1
打扰问一下尿道上裂会传染给其他人吗？,传染性,7
医生你好：为什么我老婆恶心的时候腹痛。,病因,1
1岁宝宝得痔疮怎么办?,治疗方法,5
急性化脓性胃炎应该看啥医生,所属科室,6
心绞痛会哽气吗,临床表现(病症表现),3
"""支气管扩张,经常咳血有什么方法治疗""",治疗方法,5
请问，桂附地黄丸和腰痛宁胶囊、颈复康颗粒能同吃吗？医生你说说看。,禁忌,9
请问是不是得了痔疮出现的症状和直肠癌症状一样就肯定是直肠癌了？,临床表现(病症表现),3
有痔疮能顺产吗,相关病症,4
小女孩围绕肚子眼周围天天痛是什么病,定义,0
前段时间去县城的医院面诊来，医生介绍说这是血管瘤，让我们回家观察，其他的就没有多说什么了，我想知道内蒙古婴儿口腔上颌血管瘤什么时间治疗？,治疗时间,11
糖尿病和高血压可以看啥科室,所属科室,6
手指被酸伤现在怎么办,治疗方法,5
为什么我吸了气，有一股想吐的感觉，吐不出来。只能咳嗽。,病因,1
"""复方地芬诺酯片,孕妇能吃吗?""",禁忌,9
能否介绍一下脑垂体腺瘤是啥意思,定义,0
22年前做过鼻咽癌放疗，现在舌头萎缩厉害，能康复治疗吗,治愈率,8
请教一下感冒有什么一并发生,相关病症,4
请教一下肺吸虫病能否治好,治愈率,8
最近总是尿频，睡觉时还全身酸痛是怎么回事,病因,1
快50岁，姨妈快完了，但是连续几个月，都过不去，是什么原因,病因,1
血压低会有心脏病吗,相关病症,4
做CT确定L椎体是左侧横突骨折，请问这个骨折是指陈旧性骨折还是新生骨折呢,定义,0
打扰问一下椎间隙感染如何体检,化验/体检方案,10
如果得了白睛溢血看什么医生,所属科室,6
硝苯地平控释片有什么功效，长期服用的话会怎样？,治疗方法,5
室性期前收缩是什么病,定义,0
请问得了胆道出血治疗几天,治疗时间,11
肛周长小疙瘩，便血，得了痔疮。多吃什么比较好？,禁忌,9
我家孩子睡觉抽搐吐白沫该怎么办呢？我吓死啦，现在宝宝在急诊室，大家说是干嘛了啦？,治疗方法,5
肛门有大便残留怎么办,治疗方法,5
女人晚上睡不着觉原因？担心继续这样会影响到胎宝宝的发育，亲们跟我说说。,病因,1
本人之前查出有哮喘，后来在医院治疗一段时间没什么效果，那医生还说哮喘没法治，我现在想问哮喘能治愈吗？,治愈率,8
什么是支气管炎,定义,0
问一下血管内皮瘤要做什么化验治疗吗,化验/体检方案,10
老是不好，男性小便刺痛发生这种情况一段日子了，有什么药可以吃？,治疗方法,5
请问月经量多会是什么原因引起的？,病因,1
脑梗死恢复期半年多了走路还一瘸一拐，怎么回事？,病因,1
第五跖骨断28天，今天突然没站稳，本能反应脚尖用着地了，会有问题吗？谢谢!,临床表现(病症表现),3
尿道痒痒是怎么回事？,病因,1
抱着睡踏实，吓醒哭两声拍拍也就睡了怎么办好啊？用那个药物解决啊？,治疗方法,5
急性心肌梗死是什么病,定义,0
心绞痛的症状是什么引起的,病因,1
手腕肌腱断裂后能恢复好吗,治愈率,8
舅舅得了心房颤动，表哥们想让他吃好一点，不要在因为饮食而出现其他问题，请问心房颤动的病人吃什么东西对身体好？,禁忌,9
请问月经延长经量增多怎么办？,治疗方法,5
哮喘病人适合什么锻炼,预防,2
怎么办，膀胱炎很是担心呀，这种情况严重吗？,治愈率,8
"""痔疮手术大半年后大出血是怎么回事,热情""",病因,1
您好染色体异常伴发的精神障碍现象,临床表现(病症表现),3
哮喘的症状有哪些?我感觉自己可能得哮喘了。,临床表现(病症表现),3
大便出血%20是什么原因,病因,1
脸上血管瘤怎么治,治疗方法,5
我月初的时候检查出有外阴尖锐湿疣，请问除了手术治疗还有没有其他比较有效的治疗方法呢？,治疗方法,5
左下腹部舒服，尿多。小便后好一点，是什么回事？请教大夫。,病因,1
你好，请问硝酸甘油可以有效的急救心脏停搏吗？用法用量是多少？,治疗方法,5
现在怀孕三个月了，每天不定时段心慌，心跳的厉害，没怀孕的时候有时候也会心跳加速，心慌，请问这会对孩子有影响吗？,相关病症,4
小儿麻痹症是什么？我听到有宝妈讨论小儿麻痹症的，我好奇的，谁知道小儿麻痹症是什么？,定义,0
您好小儿呼吸道合胞病毒肺炎有什么其他病并发,相关病症,4
半夜突然肚子疼，怎么办？,治疗方法,5
屁眼老是湿湿的是怎么回事。,病因,1
早期孕妇失眠怎么办，怀孕早期出现失眠的情况请问有些什么好的办法可以改善过来呀？,治疗方法,5
什么动物有强迫症,其他,12
那怎么确诊是不是尖锐湿疣呢？我现在在用洗液和康复凝胶去看了大夫，建议我，一直用药大夫说不像尖锐湿疣！,化验/体检方案,10
结肠炎的食疗？,禁忌,9
晚上睡觉心悸怎么办,治疗方法,5
周期性麻痹会影响怀孕吗？,相关病症,4
宝宝智力开发有哪些更好的方法吗？比如有什么书籍后者智力玩具推荐吗？,其他,12
室间隔完整的肺动脉闭锁是什么病,定义,0
我想问问心脾两虚，气短心悸，失眠多梦，可以用归脾丸吗？,治疗方法,5
女25岁，睡觉前老有想上厕所的感觉。而且以前一整晚不上厕所，最近一段时间总是半夜起来上厕所。请问是怎么回事？,病因,1
请问吃甜的东西经常想吐痰怎么回事,病因,1
如何预防颅骨骨膜窦,预防,2
血栓性疾病为何会导致心肌梗死、脑梗死这类疾病的发生？,病因,1
你好，麻烦问一下楔状缺损的症状是什么,临床表现(病症表现),3
尿急一个月，输的左氧不见效，郁闷，不知道怎么办，化验尿也没事,治疗方法,5
打扰问一下产气杆菌肠炎会传给孕妇吗,传染性,7
心绞痛如何判断,化验/体检方案,10
小便时疼痛带血，，，怎么回事,病因,1
阴茎短小可以增大吗？,治疗方法,5
问一下能否介绍一下卵巢病是什么意思？,定义,0
中年人高血压心绞痛怎么办,治疗方法,5
胃神经纤维瘤是什么病？,定义,0
两天前就停了中药，今天觉得口干喉干，喉痒痒的，咳咳有点啖，是怎么回事？,病因,1
男士，六十岁，有心肌病能吃阿胶吗？,禁忌,9
请问得了宫颈炎有什么一并发生,相关病症,4
如果得了肠子宫内膜异位治好得多少年,治疗时间,11
如何才可以逃开小儿遗尿,预防,2
不动手术如何治疗内痔？,治疗方法,5
孩子挂了一个星期的吊针，肚子还痛怎么回事？,病因,1
骨骺点状发育不良病症是啥,定义,0
你好，我想买盐酸芬氟拉明片，有吗？,其他,12
请问，在服用氢溴酸西酞普兰片时要注意些什么？？,禁忌,9
我想请问一下，女性尿频尿急尿多但是不痛是怎么回事,病因,1
尿酸偏高吃利舒康胶囊有用吗，平时有什么方法可以用的,治疗方法,5
请问早孕测试出来的准确度高么？,其他,12
脑膜瘤术后复查第三年需做核磁共振吗？另外核磁共振当天可以取到结果吗？谢谢,化验/体检方案,10
您好，贲门失迟缓征；慢性胃炎、胃下垂怎么治疗？,治疗方法,5
您好包皮炎的治疗周期,治疗时间,11
卵泡可能不破就排出吗？为什么还是腹痛？,病因,1
患上了外痔有哪些症状？,临床表现(病症表现),3
心绞痛抽血化验什么,化验/体检方案,10
心肌梗塞并发心室间隔穿破是什么病,定义,0
"""痔疮手术后大便后肛肠头下来,手压才进去，怎么办？""",治疗方法,5
心绞痛能办了低保吗,其他,12
心绞痛发作时吃救心丸管用吗,治疗方法,5
女人小便次数多，是怎么回事。,病因,1
先天性感觉性神经病是什么病,定义,0
2个肉芽，看上去里面好像还没长皮，是由于炎症引起还是没有恢复好，复查时主治医生说是水肿，应怎样护理？,治疗方法,5
怎么才能治好轻度外痔？,治疗方法,5
有家族心脏病史，病情的发生需要怎么才能解除。,预防,2
鼻咽癌鼻炎怎么治疗？,治疗方法,5
是想买该药来治疗肺气肿的，我是听该药的口碑还是很不错的，见该药的功效也算是蛮适合我的。,其他,12
哪个品牌的五子衍宗丸效果比较好啊，我现在更年期虚弱想调理一下,其他,12
慢阻肺用什么消炎药好,治疗方法,5
请问外阴毛痒局部起泡肛门处容易破是怎么回事？,病因,1
特发性扭转性肌张力不全是什么病,定义,0
你好，麻烦问一下解释一下化学烧伤的介绍,定义,0
顽固性强迫症怎么治疗,治疗方法,5
变异性哮喘有什么症状,临床表现(病症表现),3
胃难受恶心一直没有消失是什么原因,病因,1
痔疮的原因有哪些？,病因,1
班里有男同学得了肺结核住院了，我男朋友以前用他杯子喝过水，最近学校给做了肺结核皮试，男朋友做皮试的地方红肿了肿的挺大，请问这是感染了吗？,传染性,7
心绞痛按着胸口会痛吗,临床表现(病症表现),3
请问月经前后有偏头疼是怎么回事？,病因,1
参松养心胶囊能用来治疗房性早搏吗?,治疗方法,5
我15岁，白带就想豆腐渣一样，是什么情况,病因,1
曾有过肛瘘且复发过一次肛瘘，肛门附近长一个小疙瘩，是肛周脓肿，没化脓，现在在挂水，请问现在这个情况该怎么办？,治疗方法,5
痔疮如何调养,治疗方法,5
其他时候都不会就是跑步之后，胸口的位置就会很堵喘不上气的感觉，胸口正中心的位置还有疼痛感是为什么，本人有抽了几年的烟,病因,1
做完痔疮手术后能吃中药来消炎止痛吗？,治疗方法,5
孩子不爱喝葡萄糖酸钙怎么办，喂她喝就跑，要是强制的话还吐,治疗方法,5
男二十岁患血栓外痔一个月，想了解初期是如何治疗的？,治疗方法,5
你好，麻烦问一下手足皲裂会传给孕妇吗,传染性,7
心包内出血是怎么回事？,病因,1
是想要买该药来降血脂的，听别人说该药的效果还是很不错的，就想要买该药来服用了。,其他,12
医生说是过敏性咳嗽，从去年开始的，现在又开始咳嗽！医生说还是过敏性！该怎么办？,治疗方法,5
支气管扩张反复少量咯血怎么办,治疗方法,5
我低血压，气血不足，身体虚弱，脸上还过敏了，该吃什么药？,治疗方法,5
怎么做防范肠梨形鞭毛虫病,预防,2
药流孕囊流出来的感觉怎么办？,治疗方法,5
宝宝拉肚子吃不进药，怎么办？,治疗方法,5
八个月的宝宝夏季拉肚子怎么办,治疗方法,5
膀胱憩室治好的可能性,治愈率,8
癫痫病作为一种频繁的疾病，其病因是非常多的，人们患上癫痫病很多时候都不知道原因，那么引发原发性癫痫病的因素有什么呢?,病因,1
心肌梗死有哪些治疗措施？,治疗方法,5
家里的妻子最近总是莫名其妙的昏倒，带她去做了检查，医生说得了持续性房颤，我很担心，我想知道持续性房颤的病因有什么？,病因,1
什么是心脏早搏？,定义,0
同型半胱氨酸17.92偏高，有过脑梗塞病史，怎么预防减低氨酸,预防,2
男性尿道炎吃什么药比较好？,治疗方法,5
我是hpv43、81低危，怎么办，我不知道是不是长出尖锐湿疣了,治疗方法,5
我月经第4天可以用精油做背吗？,禁忌,9
四个月的宝宝吐奶有酸奶味正常吗,临床表现(病症表现),3
易激惹是怎么回事？,定义,0
请教一下平滑骨肉瘤要治多久,治疗时间,11
尿道口渗血丝尿黄刚拉完小便一下子又想拉，拉完有时侯有点不舒服感觉,临床表现(病症表现),3
三叉神经营养性损害要做哪些检查,化验/体检方案,10
心绞痛应如何分型,定义,0
手淫会导致阴茎短小吗？,病因,1
如果得了子喑需要做什么检查,化验/体检方案,10
有没有人可以告诉我的是，海带不仅含碘量高，不知对身体是有什么好处的呢？,其他,12
如果得了蚕食性角膜溃疡有什么一并出现,相关病症,4
今天早上凌晨两点醒来就睡不着了是怎么了呢？感觉胎动也很明显，是胎儿缺氧了么？,病因,1
5周前有过高危行为，请问医生龟头下端的白色点点是尖锐湿疣吗？,化验/体检方案,10
内分泌吃什么药好，内分泌药哪种见效快啊，内分泌失调，要吃什么呢？,治疗方法,5
你好，我想请问一下安宫牛黄丸有什么注意事项,禁忌,9
舌头只要是大脑想要舌头干嘛，舌头就不听使唤的动啦起来,临床表现(病症表现),3
你好，治疗小孩癫痫，请问，丙戊酸钠缓释片吃了对智力有影响吗？,禁忌,9
主-肺动脉隔缺损是什么病,定义,0
冬天容易发痒，情绪一上来热起来就痒得不得了，平时发痒都是立马用冷水擦下就不痒了，,临床表现(病症表现),3
打扰问一下胸降主动脉动脉瘤应该看啥医生,所属科室,6
问一下肱骨髁上骨折我会感染吗,相关病症,4
你好，我想请问一下服用安宫牛黄丸有什么禁忌，谢谢,禁忌,9
低血糖来时要怎么注意保养,治疗方法,5
咳嗽有黄痰一个星期了还没好,临床表现(病症表现),3
小孩说话晚是什么原因啊？是不是智力不达标还是舌头有什么问题呢？,病因,1
"""脖子上的血管瘤能治疗好吗？,我家孩子在脖子上长有血管瘤，红色，稍微有凸起的，内蒙古婴儿的血管瘤在脖子上，危害大不？""",治愈率,8
如何理解胆管结石与胆管炎是什么意思？,定义,0
胃节律紊乱综合征能治好不,治愈率,8
心跳过缓早搏，有没有什么关系？会不会对身体有害？,相关病症,4
冒昧问一下肠梗阻检查什么,化验/体检方案,10
孕晚期，准备预产期，得了痔疮，大便出血，疼，怎么办？,治疗方法,5
拍个片也没检查什么出来，痛的时候晚上睡不着觉，是怎么回事？,病因,1
