text,label_class,label
请问得了散发性甲状腺肿有什么并发,相关病症,4
怎么让心悸停下,治疗方法,5
走路走急了，感觉很累，胸痛，特别上楼梯提东西，吸气急。,临床表现(病症表现),3
治疗气胸的方法有哪些,治疗方法,5
我该怎样逃避咖啡因与氨茶碱中毒,预防,2
你好，我想请问一下，盐酸舍曲林片可以和帕罗西汀一起用吗？,治疗方法,5
问一下牙科病做啥体检呢？,化验/体检方案,10
口臭吃什么药,治疗方法,5
我看到该药是具有治疗体型消瘦的作用的，就很想知道是不是可以用来改善我的不长肉的情况的。,治疗方法,5
心包转移瘤是什么病,定义,0
我这几天不知道为什么老是睡不着，可是我都没有紧张也没有想什么的。是不是孕晚期都这样呢？,临床表现(病症表现),3
小儿患感冒后，怎样防止发展为病毒性心肌炎？,预防,2
脑疝的病因是什么,病因,1
"什么是左心室高电压？心电图报告""左心室高电压""是否严重？",定义,0
请问子宫好乳房疼痛怎么治疗？,治疗方法,5
请问月经推迟9天是怀孕啦吗？,病因,1
手脚平时也有麻痹的，平时血压有偏高。怎么办啊？,治疗方法,5
请教一下先天性心包缺如或缺损有什么其他病并发,相关病症,4
尿道感染应该怎么治疗？,治疗方法,5
我想知道有什么比较好的药物可以替代这个缬沙坦胶囊(怡方)？,治疗方法,5
这几天一直感觉做事没什么精神，白天爱打瞌睡，晚上又睡不着觉,临床表现(病症表现),3
我得了尖锐湿疣，几颗很小有菜花状了.不疼不痒的很纠结，求治疗方案。,治疗方法,5
支气管炎咳嗽会传染吗,传染性,7
慢性间质性肺炎如何治,治疗方法,5
脑血栓，但现在已出院，医生建议回家修养，但是现在每天只吃一点点饭，几勺，在医院会输营养液，却拉大便，这是怎么回事,病因,1
请问得了食管瘢痕性狭窄需要做什么检查,化验/体检方案,10
宝宝肚子发胀怎么办啊,治疗方法,5
右眼睡醒觉肿了！消肿后内眼皮上感觉从肉皮里长了个黄豆大的疙瘩，隔了一星期眼皮又肿了,临床表现(病症表现),3
吃错东西，肚子痛想呕，但欧不出来,临床表现(病症表现),3
请问月经来的多会有问题吗？,临床表现(病症表现),3
经常发梦怎么办，一般是什么原因引起经常做梦的啊,病因,1
左手割腕，血止住了，手可以活动，还用去医院吗,治疗方法,5
休息足血压正常患哮喘每早起床必头昏是什么原因？,病因,1
你好，麻烦问一下性交晕厥会传染给哪些人,传染性,7
你好，请问一下，珍菊降压片主要针对什么情况？妻子想确定一下这种药的确实效果，详细解说一下，知道的麻烦解答一下，谢谢,治疗方法,5
胃癌患者日常需要注意什么,禁忌,9
会阴侧切会痛吗？我听说胎儿头部太大的话，顺产都要侧切的呢！,临床表现(病症表现),3
求治疗慢性支气管炎的偏方,治疗方法,5
请问用了硝呋太尔栓剂后外阴和肛门奇痒是否过敏？,临床表现(病症表现),3
打扰问一下扁平疣要花多少时间治好,治疗时间,11
出现早搏要治疗吗？,治疗方法,5
最近老是腰疼。尿还很频，而且每次尿的还很少，尿的时候阴道还要不舒服的感觉,临床表现(病症表现),3
一岁吐奶腹泻可以吃午时茶吗,治疗方法,5
我妈妈有糖尿病，甘油三脂135了。吃什么药最好呢？,治疗方法,5
前段时间我妈妈单位体检。检查出来心肌梗塞。平时身体挺好的，我也没见她有什么特别的症状。我想知道急性心肌梗塞有并发症吗？,相关病症,4
尿频尿痛是怎么回事？,病因,1
儿童抽动症如何诊断？,化验/体检方案,10
请问得了神经梅毒治愈比例,治愈率,8
宝宝黄疸照射兰光后反弹,临床表现(病症表现),3
正常人会出现心绞痛吗,病因,1
请问阴道前穹窿有一蚕豆大硬结呈蓝色是否正常？,临床表现(病症表现),3
小孩的大便带有黏丝怎么回事呢,病因,1
请问一下，我不知道我甘油三脂过高是能不能喝丹参保心茶？,禁忌,9
经期可以烫染头发吗？？？？,禁忌,9
冒昧问一下髓单核细胞白血病易发人群是哪些人,病因,1
最近嗓子有点不舒服，而且总是咳嗽，感觉有点像支气管炎，支气管炎还有什么症状吗？,临床表现(病症表现),3
变异性哮喘在饮食上应注意什么,禁忌,9
糖尿病是体内胰岛素分泌不足导致糖代谢紊乱从而引起的多饮多食多尿主要与遗传有关能不能吃金双岐，甘露消渴胶囊吗？,治疗方法,5
四个月宝宝睡眠不好，一点点动静宝宝就自己醒来了，有什么办法可以让宝宝睡的安稳吗？,治疗方法,5
为什么新生儿的下嘴唇偶尔会发抖呢？宝妈们这种情况是否正常的呢？,病因,1
怀孕期内每天我睡15个小时正常吗？自从怀孕后每天睡15个小时，一直想睡觉，一般怀孕嗜睡多久？,临床表现(病症表现),3
早上没吃饭想吐肚子剧烈疼痛,临床表现(病症表现),3
宝宝经常性便秘怎么办?,治疗方法,5
请问得了胃柿石我会感染吗,传染性,7
睡不着，没精神，冬天怕冷，用什么药好的快的啊现在这样子？,治疗方法,5
色素性静脉旁视网膜脉络膜萎缩有什么一同出现,相关病症,4
如何会出现心悸的现象,病因,1
请问痔疮出血了，需要立即手术吗,治疗方法,5
我想要乳果糖口服液，那种比较好,其他,12
前几天我是尿路感染，然后几天大便不出来。这两天便出来了，又感觉老是想大便，有时候尿尿都感觉有大便想要出来，是怎么回事？,病因,1
多发性神经纤维瘤病是一种什么病？,定义,0
尿路感染去医院挂什么科,所属科室,6
治疗支气管哮喘土方法?支气管哮喘不易根除，听说民间有很多偏方是否值得相信?,治疗方法,5
头晕有点脑积水还有点血压高,临床表现(病症表现),3
你好，得了甲状腺瘤，朋友推荐了黄栀花五海瘿瘤丸，请问，其是国药准字号药吗？,其他,12
宝宝肠胃不好，最近老是拉肚子,临床表现(病症表现),3
八岁的孩子要服用葡萄糖酸钙梓口服溶液是18支装的，请问一疗程需要几盒才好？,治疗时间,11
来月经的时候肚子疼,临床表现(病症表现),3
前段时间总感觉龟头很痒，起了好多小水泡泡，之前以为就是湿疹。可是后来上医院检查发现不是，是叫尖锐湿疣的性病请问尖锐湿疣这个疾病到底能不能治愈呢？,治愈率,8
肛门坠痛，便细，是直肠炎还是痔疮的表现？,临床表现(病症表现),3
孕囊16x11，胎芽5mm，没有胎心是不是停育了,临床表现(病症表现),3
老年人急进性肾炎有什么一同发生,相关病症,4
什么手段可以避开皮肤白血病,预防,2
哪些人更容易患肝癌,病因,1
期前收缩是什么病,定义,0
怎么治疗胸腔积液,治疗方法,5
我的腰间盘突出2年了，最近听说追风舒筋贴膏效果不错，请问我是中央型的腿脚麻木能贴吗？,治疗方法,5
"""鱼肝油和dha的区别是什么呀？医生让我给宝宝吃一点鱼肝油,我去店里问他就让我买dha。""",其他,12
晚上容易入睡，但整晚一直做梦，睡眠质量极差，前段时间也有过这情况，怎么现在又复发了。,病因,1
食管癌的分期是怎么分的,定义,0
85岁的老人得肾结石应如何治疗,治疗方法,5
最近几年常失眠，三唑仑哪有卖？听说效果好。,其他,12
你好，医生，请问，碳酸钙D3片儿童适合吃吗？怎么服用的啊？谢谢,治疗方法,5
你好！更年期妇女可以服用知柏地黄丸吗？知柏地黄丸副作用大吗？,治疗方法,5
第一次怀孕是人流还是药流好？,治疗方法,5
"""你好，请问一下，我想了解,心脉瘀阻引起的慢性心功能不全，这种病很复杂吗，听起来好严重，怎么办？知道的麻烦解答一下，谢谢""",治疗方法,5
请问医生，大便出血是怎么引起的,病因,1
你好，朋友在吃了盐酸舍曲林片出现排尿困难，请问这是什么原因呢？,病因,1
镇静、安定、催眠药中毒可以治好吗,治愈率,8
慢性支气管炎的早期症状,临床表现(病症表现),3
腹泻的治疗方法,治疗方法,5
我两个月前因为晚上睡不着觉，而且每天总是坐立不安，后来被查出甲亢，昨天又因为胸口疼去了医院，医生说是甲亢性心脏病，我就想问，甲亢性心脏病多久能治好？,治疗时间,11
宝宝眼皮和额头上的血管瘤，现在都一岁了还没有消，怎么办呢，内蒙古婴儿眼皮上长有血管瘤咋治好啊？,治疗方法,5
每天晚上睡不着怎么办？这是不是失眠啊？听说吃枣仁有助于安神，有人试过觉得如何吗？会不会有副作用？,治疗方法,5
打扰问一下乳腺湿疹样癌治好得多少年,治疗时间,11
阿立哌唑口腔崩解片的维持量应该是多少呢？一天一粒可以吗？,治疗方法,5
你好，我想问一下，怎么判断赛乐特片盐酸帕罗西汀片是不是正品药呢？,其他,12
我该咋样抵御复孔绦虫病,预防,2
您好，我是高血压患者我服用波依定后头痛，是怎么回事？,病因,1
2个月宝宝的血管瘤极佳治疗方案是什么，长在我家孩子鼻子上的血管瘤，有凸起的血管瘤，内蒙古婴儿长在鼻子的血管瘤怎么治啊？,治疗方法,5
请问每个月的月经量都很少会对怀孕产生什么影响吗？,相关病症,4
打扰问一下鼻疖多大概率能治好？,治愈率,8
得了变异性哮喘怎么办,治疗方法,5
小孩肛门口有小豆豆是怎么回事,定义,0
有个朋友是糖尿病患者，最近叫我帮她买熊胆丸这药，不知道这糖尿病的还可以使用的吗？,禁忌,9
请问医生这是痔疮么？是什么病？还是异物导？请问医生这是痔疮么？是什么病？还是异物导致的。。,定义,0
颞叶癫痫的病因是什么,病因,1
痔疮是怎么引起的？,病因,1
请问阴道内感觉痒是什么问题？,定义,0
支气管扩张饮食方面注意事项,禁忌,9
大姆指骨折有一点错位可以打石膏吗,治疗方法,5
经常手心出热汗，脚也出，请问要怎样治疗？用什么药好。,治疗方法,5
治痔疮会影响上班吗，医保有报吗？外痔。有无报销。会否影响工作,其他,12
五海瘿瘤丸忌什么食物相克啊？,禁忌,9
我是支气管扩张患者，最适宜吃什么食物,禁忌,9
剖腹产容易自闭症吗,病因,1
医生我的了尿路感染那么在平时日常中会不会传染给家人？,传染性,7
什么人容易得强迫症,病因,1
尿道炎需要怎么治疗？,治疗方法,5
胃癌晚期拉血，怎么办,治疗方法,5
如果得了卡氏肺囊虫肺炎有传染性吗,传染性,7
如果得了寰椎骨折脱位会传染给哪些人,传染性,7
孩子肚脐上长的血管瘤，是混合型的，发病不到两个月，没去医院看过，但是咨询过这方面的问题，内蒙古婴儿肚脐上的血管瘤能治不？,治愈率,8
食管梅毒治好得多少年,治疗时间,11
小便次数多是什么病,定义,0
请问外阴长了个硬硬的东西该怎么办？,治疗方法,5
你好我有个朋友得了甲亢，症状是心跳加快，请问用什么药可以根治？甲亢灵片,治疗方法,5
这几天我老是觉得心里不舒服，喘不上气，还老是恶心想吐。有人说可能是急性心肌梗塞。我想知道急性心肌梗塞需要手术吗？,治疗方法,5
最近几天我总感觉嗓子里有东西似的，咳嗽也咳不出什么东西。呼吸困难，要大口大口地呼吸，胸闷！气短！这是怎么回事？,定义,0
今天感觉肚子发硬怎么回事？,定义,0
美国肠癌的发病情况,其他,12
早期肿瘤都有哪些症状？拉稀是吗,临床表现(病症表现),3
为什么马应龙麝香痔疮栓哺乳期妇女禁用?,禁忌,9
什么手段可以逃开播散性复发性漏斗部毛囊炎,预防,2
我婆婆经常血管神经性头痛，那我该买哪种药啊,治疗方法,5
强迫症会引起精神分裂吗,相关病症,4
为什么尿液是白色的？,病因,1
脑震荡预后好吗？,治愈率,8
你好，盐酸多塞平片要吃多久才能有效？疗效怎么样？,治疗时间,11
心绞痛需要住院吗,治疗方法,5
孕妇晚上睡不着睡着也会做梦很多怎么办才好？一个晚上就像没睡着觉一样。,治疗方法,5
老年人吃盐过多，是诱发高血压的原因吗？,病因,1
请问做完宫颈手术后需要做短波和灌肠吗？,治疗方法,5
请问得了十二指肠内瘘的症状是什么,临床表现(病症表现),3
自发性血胸是什么病,定义,0
做完内痔已12天，解大便还出血，线头还没脱落，多久后能开车？完全好要多少时间？,治疗时间,11
最近上火感冒，走路时后槽牙震得慌，老感觉要掉似的，这是怎么回事,定义,0
可以介绍原发性脑干损伤是啥？,定义,0
请问一下中医和西医治疗慢性支气管炎有什么不同吗？,治疗方法,5
孕妇晚上失眠怎么办？我现在晚上基本都会失眠，好难才能睡着的。,治疗方法,5
3周岁宝宝4至7天才一次大便，怎么办？,治疗方法,5
大骨粉已经有快8年了，现在有点歪了，已经两次头痛恶心，呕吐，不过中间隔了三年，才有两次，请问我现在可以把骨粉取出来吗？,治疗方法,5
多饮多尿的病因排除糖尿病,病因,1
我的HEM7501型血压计最近几天脉搏提示声消失了，是坏了吗？,其他,12
你好医生怀孕了严重感冒怎么办,治疗方法,5
吃完萝卜能吃么？参芪降糖胶囊,禁忌,9
您好小儿黏多糖贮积病Ⅳ型有什么并发,相关病症,4
宝宝咳嗽呕吐怎么回事？,定义,0
女性尿频尿急是什么问题,定义,0
怎样才能抵御羊膜带综合征,预防,2
克丁病患者如果长时间没有吃优甲乐，会不会对身体有什么不良的影响呢？,相关病症,4
如何做避开潜水性内耳损伤,预防,2
我想问一下我妈在服用盐酸氟桂利嗪胶囊，可以同时给他补点钙么？,禁忌,9
小孩长血管瘤需要治疗吗,治疗方法,5
强迫症会引起幻听吗,相关病症,4
大叶性肺炎输液十七天出院，回来又烧37度怎么回事,病因,1
小儿周期性高血钾性麻痹易发人群是哪些人,病因,1
请问阴道内壁长粉瘤怎么办？,治疗方法,5
蜈蚣蜇伤有什么一并发生,相关病症,4
三周半孩子大便带血是什么原因引起的，,病因,1
便血，检查出事高分化腺癌早期，已做了根治术，医生建议做化疗，是否可以不做？,治疗方法,5
孩子晚上不睡觉，闹腾，大便很干燥，这说明什么问题？,定义,0
遂宁市治疗脑瘫哪个医院好？,其他,12
中年人如何预防中风啊？这问题一直困扰我，希望可得到解决。,预防,2
你好，麻烦问一下老年人脑心综合征治疗多长时间,治疗时间,11
我妈妈今天一次吃了一瓶速效救心丸，有没有什么危害,其他,12
打扰问一下淋巴病要治几多时间,治疗时间,11
黏膜白色海绵状痣如何体检,化验/体检方案,10
宝宝大便又硬又黑,临床表现(病症表现),3
偶尔咳嗽，有痰，没血，胸闷,临床表现(病症表现),3
宝宝三四天大便一次正常吗,临床表现(病症表现),3
你好，麻烦问一下闭经性头痛需要做什么检查,化验/体检方案,10
宝宝有时候吐奶，用手感觉到宝宝呼吸时肺部有震音,临床表现(病症表现),3
怎么判断左洛复盐酸舍曲林片是否为正品？,其他,12
月经期间拉肚子怎么办,治疗方法,5
老人现在是得了脑动脉硬化症可以吃这个药吗，需要注意什么吗？,治疗方法,5
餐后血糖一小时8.5高吗,化验/体检方案,10
腰部疼痛和肚子痛,临床表现(病症表现),3
弥漫性轴索损伤要做哪些检查,化验/体检方案,10
消化不良怎麼辦？,治疗方法,5
最近总是咳嗽，但是没有痰，就是嗓子痒的难受，这是不是就是老慢支啊？,定义,0
您好肾虚腰痛治好希望大么？,治愈率,8
肋骨断一根，现在在医院住着多久能动,治疗时间,11
痔疮到省立医院挂什么科？,所属科室,6
肺癌咳血吃什么食物好,治疗方法,5
您好！膝盖以下有点发肿，轻微疼痛，和糖尿病有没有关系？,相关病症,4
您好，医生，我想咨询一下男人小便分叉是为什么,病因,1
间质性肺炎的症状?,临床表现(病症表现),3
运动性哮喘可以怎么样治疗好,治疗方法,5
脑出血有哪些症状?,临床表现(病症表现),3
苦柏洗液治宫颈时引起外痔可以用什么药？,治疗方法,5
如果得了习惯性流产要看什么科,所属科室,6
请问得了风轮赤豆可以挂什么科,所属科室,6
妊娠合并重症肌无要做哪些检查,化验/体检方案,10
我患有糖尿病，一直服用二甲双胍降血糖，我可以搭配芪明颗粒一起服用降低血糖吗？,治疗方法,5
妊娠合并慢性肾上腺皮质功能减退治好要多少天,治疗时间,11
脑挫裂伤颅前颅底骨折能留下后遗症吗,相关病症,4
宝宝肠胃不好吃什么调理？,治疗方法,5
请问月经不准时有什么调理的办法吗？,治疗方法,5
什么是哮喘病,定义,0
稳定型心绞痛如何联合用药,治疗方法,5
我想问一下，盘龙七片什么时候吃比较好啊是什么情况下需要服用啊，现在是夏季适合用吗？,治疗方法,5
宝妈们怀孕两个月都吃的什么有营养的食物呢？想来学习一下大家的方法。,其他,12
我最近陉常感觉胸口闷、请问医生怎么治疗会更加好。,治疗方法,5
尿血尿频尿痛该吃什么药,治疗方法,5
想了解老年人室性心动过速有什么定义？,定义,0
宝贝拉肚子能打预防针吗,禁忌,9
我想请问一下，尿黄服用什么药好，还有尿频尿急？,治疗方法,5
有没有罗红霉素，硒酵母片，羚羊角滴丸，希尔生洗剂,其他,12
宝宝拉肚子正常吗？,临床表现(病症表现),3
请问肺力咳和易坦静哪个好？,其他,12
请问得了透明细胞软骨肉瘤治愈概率几成,治愈率,8
肺纤维化症状都有什么啊?,临床表现(病症表现),3
怎么治疗脊椎外伤,治疗方法,5
你好！得了膀胱炎，治好了又发作，为什么膀胱炎会反复发作？,病因,1
强迫症会发展为精分吗,相关病症,4
月经不调做爱没有采取避孕措施是否会怀孕,其他,12
晚上感觉胃有点不消化，有点胀，上吐下泻还发烧,临床表现(病症表现),3
大脑萎缩能治好吗,治愈率,8
前两年才出现，注意力在不集中的情况下左眼向左偏，右眼正常，看远处注意力集中也没用,临床表现(病症表现),3
请教一下便血的症状,临床表现(病症表现),3
强迫症怎么治疗较好,治疗方法,5
尿频，尿急可以吃什么药缓解吗,治疗方法,5
问一下疣状表皮发育不良可以治好吗,治愈率,8
冒昧问一下黄斑前膜要做什么化验治疗吗,化验/体检方案,10
怀孕两个月多子宫两边有轻微痛疼胀气,临床表现(病症表现),3
你好，我想大概问一下啊孟鲁司特钠片你这里出售吗？我舅舅说别人说这个对肺气肿有用,其他,12
为什么屁眼总是痒啊？,病因,1
哪些人群是癌症的高危人群,病因,1
做爱多能引起心悸吗,病因,1
每次月经都提前几天，我是12.11号最后一次月经，27.29号不该是最佳受孕期吗？算着的，可是却没怀孕？,其他,12
妊娠合并重症肌无力怎么诊断,化验/体检方案,10
宝宝的大便颜色有点绿是怎么回事？,病因,1
阿尔茨海默病看什么医生,所属科室,6
肺组织纤维化要注意什么呢,禁忌,9
哪些食物中是含有碘的，含的量丰不丰富呢,其他,12
你好，麻烦问一下食管压迫型颈椎病是否会传染？,传染性,7
手淫导致jb跟睾丸变小该怎么办？,治疗方法,5
听说吃一些抗精神类的药物会导致身体肥胖，是真的吗？那请问吃阿立哌唑片会发胖吗？,其他,12
咳嗽鼻塞流清涕无咳痰，咽痛大汗全身酸痛新癀片和连花清瘟可以同时用吗,治疗方法,5
巨脑回畸形检查什么,化验/体检方案,10
溃疡性结直肠炎，饮食上怎么办？,禁忌,9
如何预防脑疝,预防,2
法洛四联症怎么治疗？,治疗方法,5
换生物瓣膜能撑多少年啊,治愈率,8
您好，请问尿道炎吃左氧氟沙星片和复方石韦片管用,治疗方法,5
你好，我家孩子经诊断为多动症，服用多动宁胶囊等药物已一个月，还是没有效果。请教一下，是疗程不够，还是其他原因？,治疗时间,11
如果得了阿司匹林诱发哮喘会人传人不？,传染性,7
""",我家宝贝从出生就有在大腿内侧一个包块主要症状：呈青紫色突出皮肤，诊断是血管瘤，内蒙古婴儿的血管瘤较好在什么时间治疗?""",治疗方法,5
请问什么情况下需要做子宫全切手术？,治疗方法,5
我想请问一下，一个月前女子给我打飞机会引起尿路感染吗?,病因,1
请问庤疮外露，大便出血，有时像妇女的月经样。这种现象怎么办！,治疗方法,5
请问阴道异味瘙痒白带很多应该如何治疗？,治疗方法,5
小孩老是拉肚子是怎么回事,病因,1
手淫过度会导致头疼心悸恶心吗?,病因,1
宝宝发热三天，现在已经退热有三天了，现在有点咳嗽，喉咙有点红肿，大便酸臭不成型，今天检查的血常规，还是显示病毒性感冒？,定义,0
如何预防颅脑火器性损伤,预防,2
你好，这几天我上厕所小便总是有一种刺痛的感觉，好像也总是尿不完，一下子就要去厕所，请问这是为什么呢？,病因,1
请问轻度宫颈糜烂应该怎么治好？,治疗方法,5
问一下后天性动静脉瘘做啥检查,化验/体检方案,10
心悸就是心动过速吗,定义,0
躺着或者坐着不动没事一活动就恶心,临床表现(病症表现),3
心悸会胸闷吗,相关病症,4
这几天感冒了，有什么感冒药是适合高血压的人服用的呢,治疗方法,5
请问月经周期变成了10天是怎么回事？,病因,1
创伤性膈疝有什么并发症,相关病症,4
法洛四联症手术死亡率高吗？治疗后影响寿命吗？,治愈率,8
什么是肠胀气,定义,0
据说角鲨烯胶丸能治疗糖尿病心脏病，静脉曲张，，是吗还能治疗关节炎脑中风等？是吗,治疗方法,5
孕妇晚上睡不着很烦怎么办？我怀孕五个月了，我经常晚上睡不着觉得很烦。,治疗方法,5
做CT检查右肺中叶支气管扩张，并部分管腔粘液嵌塞，左肺上叶条索灶是什么意思，严重吗？,定义,0
"宝宝受凉不吃饭,怎么办",治疗方法,5
愈美片心脏病人可以吃吗,禁忌,9
经常久坐，最近排便困难，是不是犯痔疮了？久坐会导致痔疮吗？原因有哪些？,病因,1
心肌梗死的症状是什么？,临床表现(病症表现),3
肺纤维化与什么因素有关?,病因,1
阴茎短小做爱时间短怎么治疗,治疗方法,5
这个对心脏不会有任何刺激吗，有没有什么副作用的吗,禁忌,9
婴儿严重腹泻怎么办,治疗方法,5
宝宝总是拉绿色大便，怎么办？,治疗方法,5
阴茎短小有办法治疗吗？,治疗方法,5
请问下，我室性早博4500/24小时能吃稳心颗粒吗？效果怎么样？,治疗方法,5
医生您好我今年19岁今天下课走了一段时间后上下楼梯腿膝盖突然疼请问是怎么回事呢？,病因,1
你好医生，头晕.肌无力.胆固醇高.用什么药，谢谢,治疗方法,5
高血压要注意哪些？,预防,2
医生，您好，50天前左脸被铁棍撞击，当时缝了几针，从半个月前开始头痛，今天检查cT发现脑出血，与50天前受伤有关吗,病因,1
我该如何躲开胫骨平台骨折,预防,2
打扰问一下天柱倒能治吗,治愈率,8
请问得了纤维肉瘤治疗几天,治疗时间,11
"宝宝长有血管瘤是怎么一起的,血管瘤长在我家孩子的耳后，有凸起，樱桃大小，内蒙古婴儿长在耳后的血管瘤危害有多大？",病因,1
在感冒过程中可以输免疫球蛋白吗,禁忌,9
胰岛素能不能吃金双岐，甘露消渴胶囊吗？,禁忌,9
肛瘘手术后照激光和半导体是起什么作用的,治疗方法,5
动脉硬化性闭塞症的症状有哪些,临床表现(病症表现),3
抽动症怎么治疗呢？吃药能不能治疗儿童抽动症呢，还是要通过其他的方法治疗啊？,治疗方法,5
颅内转移瘤的病因是什么,病因,1
小孩总吐奶而且消化很快是怎么回事,病因,1
结婚一年多了一直没注意这几天发现阴道口感觉有颗粒状的东西是尖锐湿疣吗？,化验/体检方案,10
我没有小肚子疼，就是向上厕所就是上不出来,临床表现(病症表现),3
我因有糖尿病和高血压现，早上吃拜新同，晚上可不可以吃非洛地平？,禁忌,9
我想知道得了间质性肺炎可以活多久?,治愈率,8
阴唇里面又疼又痒,临床表现(病症表现),3
如何才可以逃避枕大神经痛,预防,2
打扰问一下佩吉特病样网状细胞增生症会让我得上吗,传染性,7
外阴恶性神经鞘瘤看啥科呢,所属科室,6
多发性脑梗塞的病因是什么？,病因,1
我摔了一下腿磕破了用了安尔碘皮肤消毒液后用云南白药粉剂发热特别疼咋回事,病因,1
医生您好，我最近晚上经常上厕所，感觉也没怎么喝水，咳嗽就是觉得急怎么办啊,治疗方法,5
