text,label_class,label
您好，最近我检查说是尿路感染，那应该吃什么药好呢？,治疗方法,5
大便干燥带血,临床表现(病症表现),3
高血压真正服用缬沙坦可以用避孕栓妻之友吗？,禁忌,9
头上长有血块无意中发现软软，的不知道是什么，去检查后才知道是血管瘤，内蒙古婴儿为何会长血管瘤？,病因,1
鼻咽癌能过性生活吗？,禁忌,9
为什么我心绞痛时间越来越长,病因,1
不知道为什么我最近一段时间老是感觉呼吸特别困难，别的特别的难受，不知道是怎么了,病因,1
你好，请问86岁高龄，有心梗的现象。请问可以用活心丸吧？效果好吗？,治疗方法,5
婴儿打嗝时能喂奶吗？,禁忌,9
你好，我想大概问一下啊有没有糖尿病患者用的无糖型强力枇杷露,其他,12
请问阴毛上长痣还很痒怎么回事？,病因,1
经常说头痛，后脑那块，照的也痛，前一晚一点多才睡有关系吗？九岁，瘦，才四十斤,临床表现(病症表现),3
哺乳期妈妈治疗痔疮合并肛裂用什么药？,治疗方法,5
怀孕白带会变黄吗？,临床表现(病症表现),3
妇女妇科病的症状有哪些呢？,临床表现(病症表现),3
脊髓栓系综合征的病因是什么,病因,1
胸部中间一用力就痛，被人不小心踢了一脚，但之前也有过，呼吸的时候呼气时会有点疼,临床表现(病症表现),3
后部多形性角膜营养不良易发人群是哪些人,定义,0
中医药在肝癌治疗方面有什么优势,治疗方法,5
请问高锰酸钾哪里有卖的?,其他,12
请问罗红霉素能和氨咖黄敏一起服用吗,禁忌,9
酸腿疼爱出汗消化不好大便不成型失眠多梦,临床表现(病症表现),3
小孩一岁不会吃饭还老吐奶怎么回事？,病因,1
孕妇得了痔疮怎么办？,治疗方法,5
治疗胸膜炎的方法有哪些,治疗方法,5
63岁，女，脚疼，条筋拉住痛,临床表现(病症表现),3
9个月宝宝拉肚子，一天拉了十多次，有一点咳嗽和流清涕,临床表现(病症表现),3
服用哪些保健品降脂效果好?注意什么啊，辛苦啊，谢谢！,治疗方法,5
太累睡不着，想睡一抖没法睡,临床表现(病症表现),3
先天性食管闭锁表征是啥,临床表现(病症表现),3
多发性神经炎治好要多少天,治疗时间,11
你好，我有时候突然就喘不上来气，心慌，还有就是偶尔捣蒜的时候心里特别难受，现在根本没法捣蒜，甚至有时候还会觉得濒临死亡，,临床表现(病症表现),3
医生你好，我想问一下那个尿频尿急尿痛尿不尽是怎么治疗？,治疗方法,5
如何预防高热惊厥？,预防,2
北京国奥心理医院看病怎么样？,其他,12
我吃了稳心颗粒，后来才知道自己怀孕了，应该怎么办？通过什么方式？,治疗方法,5
预防痔为什么要及时治疗气管炎、肺气肿等疾病?,相关病症,4
心脏病跟高温天气有关系吗？,病因,1
癫痫疾病患者的身心带来了很大的伤害，给患者的生活带来了极大的不便，为了让大家更了解癫痫疾病，请问儿童癫痫的危害有什么？,相关病症,4
心难受，呼吸困难，痰有浓血,临床表现(病症表现),3
宝宝刚出生三天.现有大量呕血和大便带鲜红血液,临床表现(病症表现),3
我想咨询一下康弘盐酸文拉法辛缓释片的疗效怎样啊还可以吧,治疗方法,5
医生好、请问怀孕了天天可以玩手机吗？,禁忌,9
小儿肝衰竭的治疗周期,治疗时间,11
怎样绕开原发性免疫缺陷病,预防,2
饭后感觉腹胀，按压胃部有按压痛感，不反胃不恶心，东西也吃得下，想咨询下是胃炎吗,化验/体检方案,10
脱肛吃什么好,治疗方法,5
尿频，尿不尽，要窝到内裤里。,临床表现(病症表现),3
问一下皮层性多汗症看啥科呢,所属科室,6
我想问甲亢患者完全不能摄入碘盐吗？在外读书无法避免怎么解决？还是吃点问题不大？,禁忌,9
有习惯性便秘，体质便瘦，可以用什么药治疗，效果较彻底？,治疗方法,5
关节扭伤适合用云南白药关节止痛膏吗？,治疗方法,5
阴茎短小，性交时间短。,临床表现(病症表现),3
吃六味地黄丸同时也吃了感冒药要不要紧,禁忌,9
继发性闭经，雌激素药和吃妇科调经片能不能同时吃？,禁忌,9
请问肺气肿用制氧机每天应该用多长时间,治疗时间,11
我以前用百优解一停用一年现在病又发了该用什么药,治疗方法,5
失语症是怎么回事?,定义,0
甲减会不会导致心脏病,相关病症,4
癌症等于死亡吗,治愈率,8
我总是会肚子疼,临床表现(病症表现),3
更年期月经流血时间长，是否可以吃补佳乐？吃了必须吃10天孕激素吗？,治疗方法,5
支气管扩张治疗多久能好？,治疗时间,11
医生您好！我想请问想买这个琥珀酸美托洛尔缓释片,其他,12
请问外痔会在夫妻之间传染吗？,传染性,7
我的妈现在怀孕3个多月，晚上老是失眠的，担心会影响到胎宝宝，怎么办？,治疗方法,5
我想咨询一下非淋性尿道炎吃什么药最好?,治疗方法,5
如何治疗颅骨缺损综合征,治疗方法,5
宝宝56天了。大便是青色的怎么了,病因,1
小儿颅内出血有什么饮食禁忌吗？,禁忌,9
斯利安的叶酸片好呢？还是汤臣倍健的叶酸亚铁片好呢？,其他,12
过敏性哮喘反复发作，如何控制,治疗方法,5
您好类癌综合征看什么医生,所属科室,6
宝宝两个月，母乳喂养，现在母亲感冒，打喷嚏流鼻涕流眼泪加重2天，头疼，吃什么药好些？,治疗方法,5
怎样抵御病毒性食管炎,预防,2
现在我身上有一块白斑，去医院检查说这个是白癜风，怎么治疗才好呢？,治疗方法,5
打扰问一下想了解松节油皮炎有什么定义？,定义,0
请问，我背痛3个月了，B27基因检查有一个是脊椎保护行是阳性，请问我是脊椎炎吗，,定义,0
肝癌的家族聚集性是怎么样的？,病因,1
心脏病心衰怎么办,治疗方法,5
脑疝是一种什么病？,定义,0
一天疼2次，我的头痛，如何治疗效果好。吃什么啊。,治疗方法,5
前段时间发现阴道长了些颗粒，现在发现长得更多了，会痒，没有乱搞过，怀疑得了尖锐湿疣，有什么办法能治好？,治疗方法,5
小肚子那里长了个包，很疼，之前那里做过手术，是怎么回事？,病因,1
宝宝放屁，是消化不好吗？,病因,1
如果得了颅咽管瘤易发人群是哪些人,病因,1
怀孕5个月晚上睡不着这个应该要怎么办才好的啊？大家告诉我下吧，谢谢。,治疗方法,5
你好，麻烦问一下老年人原发性血小板增多症会传染给哪些人,传染性,7
宝宝咳嗽怎么办？,治疗方法,5
尿路感染吃什么药见效快？,治疗方法,5
女性尿道炎吃什么药最好,治疗方法,5
请问左侧输卵管切除会影响生育吗？,相关病症,4
头皮神经纤维瘤要做哪些检查,化验/体检方案,10
我肛门旁边长了一个豆豆很痛是怎么回事啊？,病因,1
胸闷，气短，腹痛，胀气，大便黑色，但我有痔疮，能判断是什么毛病吗？,定义,0
你好，医生，请问尿频，尿急，是怎么回事呢？急急急，谢谢,病因,1
我奶奶有高血压，朋友说这药治疗高血压病，效果很不错，是真的吗？,治疗方法,5
孩子肛门疼怎么回事,病因,1
碘伏沾在皮肤上怎么除,其他,12
能不能具体说明一下颈椎腰痛宁胶囊和舒筋健腰丸哪个好呢？,其他,12
复方木香小檗碱片可不可以治疗肠道感染、腹泻的呢？使用后有哪些疗效？,治疗方法,5
怀孕便秘吃什么？,治疗方法,5
你好医生，请问一下，鹿川活络胶囊，二氟尼柳片，哺乳期妈妈可以喝吗？对婴儿会不会有什么影响？我喂奶有6个月了。,禁忌,9
利福平胶囊的注意事项,禁忌,9
踝部骨折治好要多少天,治疗时间,11
你好，请问，老人腰疼贴吡罗昔康贴片可以吗？,治疗方法,5
冒昧问一下鼻腔囊肿能否治好,治愈率,8
膝盖右侧外面的筋经常抽疼怎么回事,病因,1
请问孕妇是不是不能喝可乐？,禁忌,9
请教一下迪格奥尔格综合征治疗多长时间,治疗时间,11
小脑脑桥角脑膜瘤是怎么回事,定义,0
宝宝穿裤子换尿布视频哪里可以看呢？我想给宝爸看一下，让他学习一下。,其他,12
原发性纵隔肿瘤是什么病,定义,0
小便刺痛吃什么药最有效,治疗方法,5
经常出去应酬，要喝很多的酒，痔疮总是复发，有时候解大便还有血滴，去医院检查说是痔疮，有的医生说是直肠癌，到底得的什么病？,定义,0
痔疮的中医治疗方法是什么？,治疗方法,5
格列齐特可以和胰岛素同时使用吗？,禁忌,9
肛门口疼，摸这像是里面的肉往外翻出来了。露在肛门口外面，该怎么治疗,治疗方法,5
肛裂用坐浴吗？,治疗方法,5
我昨天吃了两个石榴，今天就有点咳嗽了，请问一下石榴吃了会咳嗽吗?,病因,1
宝宝没大便怎么办,治疗方法,5
你好，如何治疗小便不畅？,治疗方法,5
心脏支架三个月了，心绞痛，肩膀酸含硝酸甘油有缓解，还是有点酸！什么情况,病因,1
"""孩子手臂上的红斑，中间有段时间也下去一点,前几天看的时候又变大了,也肿,就去了我们当地的儿童医院,检查说是血管瘤，内蒙古婴儿治疗血管瘤的时间是什么时候？""",治疗时间,11
怎么会有这样的现象呢，尿频，胀痛这种情况怎么去解决？,治疗方法,5
心电图异常是什么病？,定义,0
解释解释链球菌性咽炎的意思是什么,定义,0
请问这款奥氮平片主要用来治疗什么的它的疗效如何,治疗方法,5
医生，你好请问糖尿病患者可以服用参茸鞭丸吗？谢谢了啊,禁忌,9
骶髂关节扭伤做啥体检呢？,化验/体检方案,10
请问中度宫颈糜烂可以用银尔舒吗？,治疗方法,5
你好肺部有伤有气怎么处理,治疗方法,5
乙状结肠息肉切除，现在大便带血，是否是复发？,定义,0
我妈妈63了，帮她买尼尔雌醇片，发现药店都没有，请问哪里有卖？,其他,12
脑血栓偏瘫，有糖尿病，睡觉时有大便出来，一点，不是很多。怎么个情况？,病因,1
肚子胀怎么办啊?,治疗方法,5
安神补脑液和刺五加片能配合着吃吗？近两天失眠,禁忌,9
原发性体位性低血压的症状有哪些,临床表现(病症表现),3
我购买了鲨烯鱼肝油，使用的过程中有说明需要忌口吗？可以搭配其他药物一起使用吗？,禁忌,9
我患有性瘾癖，经常自己自慰，以前还可以一个星期一次，但近几天一天一次，控制不住自己，怎么办。,治疗方法,5
你好，请问一下，步长稳心颗粒十五岁小孩能服用吗？,禁忌,9
怎么治疗妊娠合并重症肌无力,治疗方法,5
间质性肺炎的晚期症状是什么?,临床表现(病症表现),3
咋免得贝克痣,预防,2
小肚子很疼怎么办,治疗方法,5
请问颅骨缺损综合征症状是什么,临床表现(病症表现),3
宝宝50天孕妇犯痔疮大便出血且非常疼痛、有什么方法可以迅速止痛且喂奶不影响宝宝,治疗方法,5
肛门周围皮肤发黑怎么回事?,病因,1
肛裂如何治疗,治疗方法,5
请问焦虑症能吃心神宁片吗？吃起来效果好不好？,治疗方法,5
打扰问一下阴道上皮内瘤样变得治疗几个小时,治疗时间,11
欣然硝苯地平控释片空服对胃有害吗？是否可长期服用,禁忌,9
脑萎怎么办,治疗方法,5
请问得了巨幼细胞性贫血有什么伴随发生,相关病症,4
子宫强光斑是什么？,定义,0
请问真实怀孕的日期怎样来计算？,其他,12
慢性食管炎要做哪些检查,化验/体检方案,10
怀孕初期睡觉老是睡不着怎么办？怀孕2个月了，不知最近怎么了老是睡不着，该怎么办？,治疗方法,5
最近失眠，做爱也来得很快，想问下有什么比较好的药？,治疗方法,5
请问月经来完半个月后又来是怎么回事？,病因,1
有心悸的人可以怀孕吗,相关病症,4
用塑料管插入肛门做按摩，大概深入7厘米左右，过一段时间拔出来后顶端有少量血迹，什么原因,病因,1
请问脑鸣在哪个科就诊,所属科室,6
鼻咽肿瘤恢复率是多少？,治愈率,8
孕期如何预防胎儿先天性心脏病？,预防,2
硬化萎缩苔藓有传染性吗,传染性,7
如果得了子宫内膜增生要做什么化验治疗吗,化验/体检方案,10
请问阴道两边好痒是怎么回事？,病因,1
一个月前肛门长了两个小肉粒，现在数量增多，质地较硬，不痛不痒的，请问是不是尖锐湿疣呢?,定义,0
你好！我想咨询一下，肾结石服什么药效果最好啊？,治疗方法,5
你好，我今天中午腿插破了，我能用碘伏吗？里边弄上土了，伤口现在是黑的，我应该怎么办？,治疗方法,5
阑尾腺癌会传给孩子吗,传染性,7
您好眼外肌广泛纤维化综合征治好的可能性,治愈率,8
请问结肠癌术前选择什么样的治疗方法呢？,治疗方法,5
您好过劳肥如何体检？,化验/体检方案,10
男，52岁，脑血栓，在服用华法林钠片，想咨询一下服用华法林钠片饮食上需要注意些什么？,禁忌,9
咳嗽，头晕，无力。咳嗽时间比较长,临床表现(病症表现),3
17岁吃葡萄糖酸钙可以长高吗？,其他,12
心包填塞是什么病？,定义,0
慢性支气管炎是什么症状,临床表现(病症表现),3
现在7个月的宝宝可以在拉肚子之后喝一点葡萄糖水吗？我觉得孩子缺失的水分太多了。,治疗方法,5
孕晚期睡不着，好不容易睡着后没几个小时就醒了，怎么办好呢？,治疗方法,5
想知道自己是不是得了肿瘤，要做什么检查,化验/体检方案,10
"""我家孩子额头有2个小包块，去检查说是血管瘤，请问各位专家是吗,内蒙古婴儿额头长两个很大的血管瘤咋治好？""",治疗方法,5
心悸说不出话是煤气中毒吗,定义,0
请问小儿脊髓肿瘤症状表现是什么,临床表现(病症表现),3
我该如何躲掉老年性癫痫,预防,2
我的肩膀痛有时放射到脖子上疼，胳膊疼手脖子也疼，早上起来感觉到胳膊没没劲,临床表现(病症表现),3
得了冠心病必须放支架吗？,治疗方法,5
鼻咽癌放化疗后白细胞下降是怎么回事？,病因,1
请问月经推迟了二十多天没来怎么回事？,病因,1
11个月宝宝便秘怎么办,治疗方法,5
心绞痛吃什么药效果最好,治疗方法,5
请问右腿内侧和阴部的内侧都腿酸是什么原因？,病因,1
支气管炎治疗用什么方法好?,治疗方法,5
心绞痛时候应怎么办,治疗方法,5
半个月前得了肺炎，现在深呼吸感觉左肺痛，偶尔咳嗽,临床表现(病症表现),3
打扰问一下想了解卵巢浆液性肿瘤的定义,定义,0
宝妈们给三岁大的宝宝吃鱼肝油，应该选择哪种比较好呢？求推荐好的产品，选择困难症,其他,12
有轻微强迫症怎么办,治疗方法,5
心脏畸形是什么病？,定义,0
血栓通胶囊是不是可以治高血糖呢？还是吃降糖药啊？,治疗方法,5
孕妇失眠多梦怎么办？怀孕8个月了，最近晚上失眠要很久才能睡着。,治疗方法,5
腺样囊性癌做啥检查,化验/体检方案,10
20岁喝这个有助于长高吗三精牌葡萄糖酸钙口服药,其他,12
怀孕两个多月，大肠干燥、便秘还有痔疮（混合痔），请问怎样缓解这些症状？肠干和便秘是从小到大一直这样！,治疗方法,5
不知道怎么回事前几天开始左脚有一点神经抽动特别是移动一起身就感觉好像很奇怪之前没有这样过有点酸,临床表现(病症表现),3
间质性肺炎早期能活多久呀,治愈率,8
怀孕前三月吃核桃好吗？什么时候吃对宝宝以后的智力发展是最好的呢？,其他,12
颈内动脉海绵窦瘘能否治好,治愈率,8
甲状腺功能亢进伴发的精神障碍是什么病,定义,0
请问医生肾结石吃什么药好的快,治疗方法,5
你好，麻烦问一下角膜溃疡有什么一起发生,相关病症,4
您好，80岁了，只是我不清楚这二药合并行吗?有什么建议吗,其他,12
请问小孩子肛门痒是什么原因,病因,1
皮肤血管瘤怎么治,治疗方法,5
你好，鱼刺卡在食道里面的，怎么睡觉？,其他,12
肺部肿瘤就是肺癌吗什么是肺部肿瘤,定义,0
如果得了黏多糖贮积症Ⅳ型可以看啥科室,所属科室,6
昨天割腕，血止住了，就是不能活动太大，活动太大就会流血，做了基本包扎，还需要去医院吗,治疗方法,5
病毒性脑炎后遗症是什么,临床表现(病症表现),3
月经量少，到持续了10多天怎么办,治疗方法,5
支气管炎如何治疗好，如何调理,治疗方法,5
你好，我的血压低来月经的时候头疼的受不了，怎么办，能不能营吃调理,治疗方法,5
宝宝咳嗽流鼻涕怎么办？,治疗方法,5
你好，我想问一下，我现在怀孕快五个月了，一晚上没小便，早上醒的时候肚子两边有点疼咋回事是大肚子两边,病因,1
孕期头痛怎么办,治疗方法,5
新生儿缺血缺氧性脑病怎样治疗,治疗方法,5
心绞痛吃什么,治疗方法,5
晚上安静左耳能听见心跳声，不定时，之前查完耳朵没有问题，,临床表现(病症表现),3
打扰问一下脊柱畸形治疗时间长吗,治疗时间,11
疱疹样湿疹要挂什么科室,所属科室,6
颅骨缺损综合征是一种什么病？,定义,0
氨碘肽注射液你们健客网站有卖的吗？应该怎么购买？,其他,12
我最近在睡觉之前用意可贴，不知道为什么现在早上起来就发现黄色的地方起泡泡了？,病因,1
请问中药灌肠盆腔炎可以吗？,治疗方法,5
你好，请说明一下奥麦伦盐酸氟西汀胶囊是哪里生产的呢？是礼来苏州制药有限公司吗？,其他,12
我年龄还小可是平常一多运动就难受，我也是低血压！平常就是想吐！走路不到十分钟眼睛就黑了！该咋办,治疗方法,5
你好！那结痂后，用碘伏用有色素，更容易留斑痕吗？,其他,12
能否告知无症状性脑梗死是什么意思？,定义,0
上厕所的时候刚肛门流血但是不疼该怎么办,治疗方法,5
过敏性咳嗽要怎么治疗？,治疗方法,5
"""我怀孕五个月了总便秘,有没有什么办法""",治疗方法,5
母乳期可以喝咳速停糖浆吗，小孩1周了,禁忌,9
感觉心跳有时比较快，还有疼痛感不过不严重用手拍打会减轻，而且感觉是在上半部分,临床表现(病症表现),3
女宝宝臀部护理有哪些的要点的呢，宝宝有几个月了，那怎么护理比较好的呢？,其他,12
高血压可以吃罗麻丹吗,治疗方法,5
胃四联疗法会导致心悸吗,相关病症,4
我想知道拜新同和尼群地平是不是同一类型的降压药，功效都一样的吗,其他,12
女儿自从上高中以后学习压力比较大一直月经不调，请问高中生月经不调怎么办？,治疗方法,5
你好，麻烦问一下钩端螺旋体病神经系统表现治愈概率几成,治愈率,8
尿刺痛，尿不尽，炀炀的，一点点滴，刚尿后，一阵又想尿，,临床表现(病症表现),3
请问小孩子消化不良能服用龙牡壮骨颗粒？,治疗方法,5
先天性肺部囊性腺瘤样畸形是什么病,定义,0
孩子大便呈线状怎么回事,病因,1
请问甲状腺瘤术后三个月又复发了，现有一公分大还需要手术吗？,治疗方法,5
怎样判断什么是稳定性心绞痛和不稳定性心绞痛,临床表现(病症表现),3
脑出血后引起的坠积性肺炎要怎么办？,治疗方法,5
2岁的宝宝不愿吃饭怎么办,治疗方法,5
怀孕三个半月吃了四片胺碘酮，对胎儿有影响吗？,相关病症,4
请问得了痉挛性肠梗阻治疗几天,治疗时间,11
打扰问一下脑型肺吸虫病要检查啥项目？,化验/体检方案,10
存在严重失眠的情况，如今每日都在口服艾司唑仑该咋办的呀？,治疗方法,5
四个月的宝宝恶心、干呕怎么办？,治疗方法,5
颅骨骨膜窦的病因是什么,病因,1
幼儿几岁学习用筷比较好呢？现在宝宝两岁了，想过一段时间让他自己吃饭。,其他,12
我想问下糖尿病可不可以用杜密克可以治疗便秘吗？,治疗方法,5
运动性哮喘运动后会发作吗?,临床表现(病症表现),3
如何免得小脑脑桥角脑膜瘤,预防,2
有点内火重，也不怎么吃饭，晚上睡觉的时候总是把脚放在被子外边的，在饮食和作息方面的平时要什么需要注意,禁忌,9
变异性哮喘能治愈吗,治愈率,8
过敏性哮喘怎么根治,治疗方法,5
冒昧问一下肠扭转综合征会让我得上吗,传染性,7
打扰问一下小儿急性胃炎会传给老人吗,传染性,7
你好!我双肾结石，做过激光碎石，还是有肾结石，引起肾结石的病因有哪些？,病因,1
弥漫性轴索损伤怎么回事,病因,1
你好小便到最后刺痛并伴有出血并且正是月经刚刚来喝些凉茶和大量水有好转但这是第二次情况请问确是何因？,病因,1
你好，我想请问下房颤心率可以吃参茸鞭丸吗？可以给我解答下吗？谢谢,治疗方法,5
总想上厕所怎么回事？,病因,1
间质性肺炎还能治好吗？,治愈率,8
怀孕期间小便流血怎么回事,病因,1
你好，麻烦问一下腰部慢性劳损如何体检？,化验/体检方案,10
你好医生，我想咨询一下，肋骨骨折恢复五十天了能过性生活吗,禁忌,9
尿急、痛，小便后发现尿中有点血，没有尿也想上厕所,临床表现(病症表现),3
最近在吃复方丹参滴丸，只是不知道这个药物能长期吃的不,其他,12
安卡性肾炎要做什么化验治疗吗,化验/体检方案,10
请问，尿频，该吃什么药？,治疗方法,5
心绞痛时心率快吗,临床表现(病症表现),3
先天性肌病怎么回事,病因,1
如何鉴别骨葆片这个药品，是正品还是伪劣品呢？,其他,12
学习压力比较大，老是失眠睡不着，有什么方法可以缓解？,治疗方法,5
颞骨和下颔骨关节异常我会感染吗,传染性,7
我同事小刘两个月体检时查出二尖瓣关闭不全，昨天又有个同事也是这个病，就觉得很好奇，所以想问，二尖瓣关闭不全会传染吗？,传染性,7
你好，上次体检尿常规化验单医生看了说我有点尿路感染，吃什么药好呢？,治疗方法,5
请问这个月来月经不正常仅一天量少呈黑色？,病因,1
癌症高发地区的人们如何防癌,预防,2
如果得了亚急性硬化性全脑炎挂啥科,所属科室,6
尿道感染流出黄色很浓液体·有异味·排尿有点疼,临床表现(病症表现),3
最近舌尖上有疮，用盐治疗过，效果不大。我可不可以用牛黄解毒片治？如果可以，要怎么治？,治疗方法,5
退烧是安乃近好还是布洛芬缓释胶囊好该用什么药,治疗方法,5
如果得了银屑病关节炎性巩膜炎治愈需要几年,治疗时间,11
脂肪栓塞综合征治好希望大么？,治愈率,8
我老公家族里是有哮喘的遗传史的，而这几天老公也总是在咳嗽，于是这让我非常的担心。想了解下咳嗽变异性哮喘的症状到底有哪些?,临床表现(病症表现),3
高锰酸钾中毒治愈概率几成,治愈率,8
请问子宫膜稍大有子宫肌瘤如何治疗？,治疗方法,5
"""患有内痔，大便正常，经常疼痛,应如何治疗？""",治疗方法,5
支气管哮喘为什么呼气比吸气困难？感觉就像是要憋死似的。,病因,1
如果得了板层状鱼鳞病治愈概率几成,治愈率,8
请问来士普和舒必利的适应症分别是什么可以给我介绍一下嘛,其他,12
问一下怎样解释癌症是啥意思,定义,0
晚上安静能听见左耳，心跳声，不定时的,临床表现(病症表现),3
请问月经推迟很多该怎么办？,治疗方法,5
尿道口有点红肿，不痒也不痛，刚刚开始就一点点红，这两好像尿道口红肿的面积扩大点,临床表现(病症表现),3
你好，麻烦问一下男科外伤治疗多长时间,治疗时间,11
宝宝五个半月这两天有口臭，大便很干怎么回事,病因,1
着床后会造成心悸吗,相关病症,4
头眩晕是高血压吗？,病因,1
之前洗澡发现大阴唇长了一个黄豆大小的包不痛不痒，然后我感觉周围好像有一些细小颗粒我是不是得了尖锐湿疣啊?,定义,0
男遗精年龄多少,临床表现(病症表现),3
尿道炎的症状是什么？,临床表现(病症表现),3
如何减掉臀部两边的肉？怀孕期间做的太多了臀部有很多的赘肉，有什么好的办法快速减掉臀部两边的赘肉呢。,其他,12
自发性气胸(呼吸内科)是什么病,定义,0
你好朋友、你说肾结石、你有办法帮到我、我不知那找你、你的QQ是什么,其他,12
13个月的宝宝不吃饭怎么了,病因,1
阿立哌唑片好像有分进口与国产的，请问国产跟进口药效一样吗？有什么区别？,其他,12
您好，医生，我想咨询一下尿道炎快好了，可以光吃罗红霉素么,治疗方法,5
心绞痛和胃痉挛的症状相似吗,临床表现(病症表现),3
小便刺痛有脓状分泌物,病因,1
胸廓出口综合征是什么病,定义,0
肚子不痛，但很想上厕所,临床表现(病症表现),3
问一下习惯性流产传染性强吗,传染性,7
问一下小儿两性畸形有什么一起出现,相关病症,4
尿道口刺痛，怎么回事？,病因,1
强迫症能成为正常人吗,治愈率,8
孩子大便脱肛是怎么回事,病因,1
